text	emotion
나는 당신을 따라 잡고 파이프 라인 그룹의 새로운 이야기를 공유하고 싶습니다.	중립
그에게 전화하여 토론하십시오.	중립
요즘 학업 때문에 친구들이랑 못 만나서 외톨이가 된 기분이야.	당황
은퇴 후에 친구와 각각 가게를 열었는데 친구의 가게만 번창해.	상처
딸이 큰 수술을 받았는데 아직까지 깨어나지 못 하고 있어. 영영 못 깨어날까 봐 두려워.	불안
애가 사춘기라 그런지 말을 통 안해서 당황스럽네.	당황
이번에 대기업 면접을 봤었는데 솔직히 별로 기대 안 했거든. 근데 아까 최종 합격했다고 연락이 왔어!	기쁨
3 월 12 일 오전 10시에 위의 그룹과 이야기를 나누기 위해 회의를 할 수 있습니까?	중립
자식들 다 키우고 남편과 이혼해서 수입이 없어졌어. 지금껏 돈도 못 모아둔 게 한심해.	분노
내가 확인합니다.	중립
모든 옵션을 더 잘 이해하려면 페이지를 살펴보십시오.	중립
또한 RFP에 대한 완전한 응답 사본을 보내 주시기 바랍니다.	중립
코로나 때문에 대중 교통을 이용하기가 무척이나 꺼려지네.	분노
월요일 만나요!	중립
새로운 팀에 합류하게 되었는데 평소에 꺼리던 사람도 같은 팀이어서 불편해.	불안
어리게만 보았던 과 후배가 오늘 갑자기 많은 사람들 앞에서 나에게 고백했어. 너무 놀랐어.	당황
업무가 많아 짜증 나고 힘든데 일이 잘 풀리지 않아 상사한테 혼났어.	당황
조금씩 모아둔 노후 자금을 가장 친한 친구가 좋은 투자처가 있다 해서 믿고 투자했는데 사기였어.	상처
최근 내 가족들이 왜 그러는지 모르겠어.	불안
나는 오랫동안 소프트볼을하지 않았으며, 이것은 내가 함께 일하는 사람들을 알 수있는 좋은 방법입니다.	중립
내일 봐요.	중립
우리 아내가 입원해서 내가 돌봐야 하는데 잘못하면 죽을 것 같아 두려워.	당황
우리는 노동절 이후 수요일에 나가야 할 프로젝트에서 귀에 달려있었습니다.	중립
이 기간이 지난 후에도 계속 이메일을 받으면 아래를 클릭하여 소비자 서비스에 연락하십시오.	중립
허리가 아파서 식당 일을 그만두어야 해. 자식들에게 손을 벌려야 하는 내가 한심하고 싫어.	분노
회사에서 직무 때문에 스트레스를 받는데 남편 소득도 적어 일을 그만둘 수도 없어.	상처
우리는 이번 수요일에 John Foster와 정오 약속을 잡았습니다.	중립
큰아들이 원해서 없는 살림에 무리해서 유학까지 보내줬는데 회사에 다닐 생각을 안 해.	분노
생명을 다시 상상 한 후 이메일 수신을 중지하려면 $ 링크를 클릭하여 구독을 취소하십시오.	중립
15%에 대한 참조를 취하는 것이 합리적이라고 생각합니다.	중립
반지 외에도 Ringya의 전체 주소록에 액세스 할 수 있다는 사실을보고하게되어 기쁩니다. Ringya가 연락 해야하는 모든 사람에게 도달 할 수있는 장소로 만들었습니다!	중립
필드를 작성하십시오 :	중립
요즘은 밖으로 나다니는게 참으로 조심스러워.	불안
제목 : 회의	중립
아래에서 중국 비자 요구 사항을 찾으십시오.	중립
우리는 살아가면서 갑작스러운 부고를 접할 때가 있지.	상처
귀하의 지원 요구 사항에 도움이되므로 아래 계정 및 장치 정보를 삭제하지 마십시오.	중립
당신은 희망적으로 의도하지 않았지만, 내 느낌은 마지막으로 매우 아 was 다. 그리고 나는 지금 당장 그것을 다시 다룰 수 없다.	중립
연애는 해서 뭐해? 어차피 결혼도 못 할 텐데.	슬픔
결혼 준비하면서 요즘 남자친구와 자주 싸워.	분노
난청이 있는데 아르바이트를 하면서 잘 못 알아들으니 손님들이 불쾌해했어. 다 나 때문이야.	당황
엄마가 계속 내 방에 들어오시는것 같아.	분노
남편이 자꾸 당뇨에 좋다고 이상한 먹을거리를 가져와.	분노
나이가 들면서 기억력이 점점 쇠퇴하는 것 같아 혼란스럽네.	불안
남편이 출장이 잦은 일을 하니 부부 사이가 멀어지는 것 같아. 힘들고 외로워.	불안
신장질환으로 투석하고 있을땐 내 몸의 기운이 우울해지는 것 같아. 힘이 전혀 안나.	슬픔
* 사용하려는 명령을 누릅니다	중립
최신 이메일 클라이언트와 함께 열 수 있습니다.	중립
응용 프로그램을 삭제하고 다시 설치하십시오.	중립
오늘 친구랑 싸워서 속상해.	불안
어릴 때부터 역사만화를 읽어서 그런지 국사에 관해선 모르는 게 없어.	기쁨
느린 입찰 주간이 아니라면 다음 주에 수요일에 이르면 내일에 갈 수 있습니다.	중립
예를 들어, 주택 소유자 보험에 가입하십시오. 예를 들어, 우리는 전국 최고의 보험 회사에 대한 경쟁적 따옴표를 제공 할 수 있습니다.	중립
자세한 내용은 자세한 내용이 있으면 논의하겠습니다.	중립
만나서 반갑습니다 .... $ 링크	중립
공부 많이 했는데 시험을 망했어.	슬픔
당신이 아직 당신의 캘린더를 표시하지 않은 경우, 내일은 회사와의 2 주년이 될 것입니다.	중립
일을 그만두고 나니 몸보다는 마음이 더 편치가 않네. 요즘에 심해진 강박증 때문에 내 처지를 생각하면 더 눈물이 앞을 가려.	슬픔
이제 가장 강력한 천사 인이 메달리온과 대천사 마이클이 왜 당신의 꿈을 살 수 있도록 기적, 보호,지도 및 사랑을 전달할 수 있습니다.	중립
마지막 주말에 Bogo + 15% 할인 + 무료 배송!	중립
아래 URL을 브라우저에 복사하여 붙여 넣으려면 소유권을 주장 하고이 이메일 주소를 활성화하십시오.	중립
그들은 다음 주에 Debra Bowen에게 처음으로 주려고합니다.	중립
내가 모르는 사이에 내 통장에서 천만 원이 출금되어서 너무 당황스러워.	분노
내 나이는 아직 멀었다고 생각했는데. 생각보다 먼 이야기는 아닌 것 같아.	슬픔
David, 일단 요구를 받으면 배치 전에 논의 할 수 있습니다.	중립
이번에 새로 들어간 회사가 정말 좋아.	기쁨
나 드디어 임신에 성공했어.	불안
처음 참여한 큰 프로젝트에서 실적이 잘 나왔을지 불안해.	불안
동창회에 가서 친구가 유방암 진단을 받았다고 하길래 당혹스러웠어.	불안
프로그램의 리소스 관리 및 코칭 부분의 경우 프로그램의 가능한 변경 사항을 먼저 어디에서 찾을 수 있는지 기다리십시오.	중립
나에게 아들이 한 명 있었는데 몇 년 전에 암으로 세상을 떠났어.	슬픔
회의 후 인상을 알려주십시오.	중립
우리는 우리의 다소 느슨한 것에 대해 더 많은 tonite를 이야기 할 수 있지만, 매주 이러한 일을 끝내기위한 훨씬 효과적인 수단.	중립
마음을 바꾸고 TextFree에게 또 다른 시도를하고 싶다면 언제든지 새로운 번호를 얻을 수 있습니다.	중립
"기술이 가득한 전기 배가 고픈 회사가 돌아올 때마다 팝업되고 대형 전력 그리드가 덜 신뢰할 수있게되면서 더 자주 발생하는 정전 및 브라운 아웃으로 인해 분석가는 분산 에너지 서비스를 가능한 솔루션으로 지적하며 ""다음""다가오는 10 년 동안 큰 투자 기회. """	중립
오늘 고심 끝에 부모님께 내가 동성애자인 사실을 말씀드렸는데 이해해주셔서 너무 기뻐.	기쁨
이 펄 트리에서 결정에 도움이되는 리소스를 확인하십시오.	중립
웹 브라우저 에서이 메시지를 읽으려면 아래 웹 페이지를 방문하십시오.	중립
후배 직원이 기안서 내용의 순서를 자꾸 바꿔 당황스러워.	당황
머릿속으로만 좋아한다고 고백하고 말로 용기 내서 고백 한 번 못한 내 자신이 부끄러워.	당황
나는 사람의 감정을 함부로 판단하면서 따돌리는 애들이 정말 증오스러워.	당황
다음 주에 끝나면 다시 논의하겠습니다.	중립
이번 학교 폭력 위원회에서 가해자들이 징계를 크게 받게 됐어.	기쁨
7 월 14 일 일요일에 킬리언 홀 웨딩 엑스포로의 2 장의 티켓에 대한 Deem의 새로운 홈런 제공은 여기에 있습니다 : $ 링크	중립
제공 할 수있는 모든 데이터가 도움이됩니다.	중립
이 여정을 따라 어떻게 도울 수 있는지 알려주십시오.	중립
그리고 우리는 그들에 대해 생각 나게 할 수 있습니다	중립
오늘 여자친구랑 헤어졌어.	슬픔
내 나이가 벌써 곧 마흔인데 아직도 주변에서 나만 혼자야.	불안
이제 늙어서 힘이 다 빠졌나 봐. 이제 쌀 한 포대를 드는 것도 내게 무리야.	상처
지난주에 시아버님이 돌아가셔서 너무 바빴어. 큰일 치르고 나니 몸살에 위경련까지 너무 아파.	슬픔
오늘 부모님께 좋은 식당에서 음식을 대접하기로 했어. 기대된다.	기쁨
나는 이것이 실제로 좋은 일이라고 생각합니다. 우리의 제안은 비교하여 훨씬 더 선호하는 대안처럼 보이고, 그 과정에서 우리의 지원을 더욱 중요하게 만들고, Harvey가 캘리포니아의 부서진 시스템을 수정하기 위해 선거에서 Ralph Nader를 선거에서 동등하게 설정합니다.-잠재적 인 스포일러.	중립
집에 가서 가족들과 함께 하는 시간이 가장 편해.	기쁨
당신의 경험과 기술이 당신이 신청하고자하는 직책에 대한 직업 설명에 어떻게 적합한 지 생각해보십시오.	중립
그런 다음 원하는 경우 목표에 대한 몇 가지 질문에 답변 해 주시면 관심있는 몇 가지 도구를 알려 드리겠습니다.	중립
쓰기에 대해 너무 나쁘지만 WSJ에서 LJM 이야기를 즐겼습니다.	중립
As you might know, most of EnergyUSA was given pink slips effective over the next 3-6 months.	중립
젊었을 때 돈이 전부라고 생각해서 남에게 피해를 주면서까지 돈을 모았던 내 삶이 후회가 되고 용서를 빌고 싶어.	슬픔
직장 동료들에게 성 정체성을 이야기하니까 나를 벌레 취급했어.	분노
예약하십시오.	중립
여자친구의 소비력에 정말 혀가 내둘러질 정도야.	분노
아내에게 잘해주지 못했던 것이 너무나도 후회돼.	당황
회의에서 다음 토론/의제를 살펴 보는 것이 도움이 될 것이라고 생각합니다. a) 브라질과 아르헨티나 가스 및 발전 시장을 검토합니다 - 흐름, 그리드, 참가자 (입찰 및 제안), 자산, 수영장 구조, 규제 및 정치환경, 통화 및 신용 문제, 공급 및 수요 및 역사 가격 및 양;b) ESA의 현재 규제/규제되지 않은 자산 및 생성 전략을 검토합니다.c) ESA 현재 도서 위치, 시장보기, 제품 및 제품 개발을 검토합니다.그리고 d) 다른 S. American 시장에 대한 간단한 검토.	중립
귀하의 옵션을 이해하고 귀하에게 가장 적합한 프로그램을 결정하는 데 도움이되는 전문가와 연결할 수 있습니다.	중립
전기는 이전에 국제 운영자와 자유 시장 규칙에 개방 된 주를 엄격하게 통제 한 최초의 미국 산업입니다.	중립
자식들을 다 키우고 나니 내게는 남은 게 없는 기분이라 상처야.	상처
Enron에서 고용 된 최근 OU 졸업생 목록을 얻을 수 있습니까?	중립
인사 : 이것으로 귀찮게해서 죄송합니다.하지만 여행을하고 있습니다. 내 내일의 음성 메일 회의를 위해 전화 번호를 남길 수 있다면 영원히 빚 을질 것입니다.	중립
난 가난해서 노동만 하네.	분노
남편은 건강해서 자식들에게 병원비 부담을 안 주는데 난 아픈 못난 엄마라 자식들에게 병원비 부담을 주네.	슬픔
아마도 같은 통화를 기록하거나 E : 목록에있는 나머지 사람들에게 우편으로 보내지 않을 것입니다.	중립
이번 병원 의사 선생님은 정말 믿음이 가.	불안
사고로 인해 몸이 불편해서 집에만 있는 내 처지가 불행해.	슬픔
Glyder를 열어 피드백 템플릿을 얻으십시오 - 일주일 동안 만 무료입니다!	중립
이 팀장은 항상 내가 하는 말을 거역해. 화가 나!	분노
사랑하는 아내가 세상을 떠났어. 다 내 잘못인 것 같아.	분노
만약 당신이 몇 가지 팁과 조언을 찾고 있다면 나와 함께 근무 시간을 초대 할 것이라고 생각했습니다.	중립
우리가 지금과 목요일 사이에 이야기하지 않으면 우리는 그때 이야기 할 것입니다.	중립
가끔씩 건망증이 있을 때마다 아내가 치매 조심하라고 놀려서 화가 나.	분노
여자친구가 상견례 날짜를 바꾸자고 해서 일정을 조정하는데 힘드네.	기쁨
애들 둘 교육비로 지출을 계속했더니 은퇴 후 생활비 생각하면 한숨만 나와.	당황
Katherine L.는 영화 '2013 년 3 월 5 일부터 My Movie'를 나누고 싶어합니다!	중립
그녀는 앞으로 2 주 안에이 직책을 채우려 고하지만, 이것이 나에게 제가 이력서를 HR 채용 담당자 인 Dianne White에게 전달할 것이라고 언급했다고 언급했다.	중립
2000 년 11 월 8 일에 이메일을 보냈고 오늘 당신을 생각하고 있었고 우리가 다른 사람들에게 도착했을 때 어느 날 아침 사무실에서 오랫동안 대화를 기억했습니다.	중립
오늘도 폐지 주워 오천 원밖에 못 벌었어. 앞으로 어떻게 살지 왜 난 이따위 사람일까.	분노
공부가 내 취향은 아니라 공부를 안하는 것 뿐이야.	분노
회사에서 내 업무들이 늘고 있는데 후임자가 없어. 업무를 분담하지 못해서 화가 나.	분노
남자친구가 늘 내 마음을 몰라주는 것 같아서 고민이야.	상처
이번에 대장암 수술비가 너무 많이 나와서 속이 시커멓게 타 들어 가는 줄 알았어.	분노
남자친구가 결혼하자는데 결혼은 꼭 해야 하는 걸까?	슬픔
몸이 많이 아파서 친구들을 잘 못 만났더니 거의 연이 끊겨버렸어.	상처
남편한테 속 터놓고 이야기하는 게 어렵네.	분노
Stan Horton은 초대를 감사합니다.그러나 그는 참석할 수 없습니다.	중립
사무실의 모든 사람 이이 전화 번호를 가지고 있는지 확인하십시오.	중립
지금 사귀고 있는 애인과 헤어지면 다시는 누군가를 사랑하지 못할 것 같아서 슬퍼.	슬픔
요즘 힘들어서 미칠 것만 같아.	당황
엄마 잔소리에 나도 모르게 엄마한테 심한 말을 했어. 이런 내가 지긋지긋해.	분노
엄마랑 또 성적 때문에 싸웠어. 이번에 성적이 엄청나게 떨어졌거든.	슬픔
기부금은 얼마입니까?	중립
우리 아빠는 나한테 제대로 된 선물 한 번 준 적 없으셔. 너무 서운해.	상처
내가 아이들한테 너무 무섭게 대하나 봐. 남편한테는 잘 웃고 대화도 잘하는데 나한테는 안 그래.	상처
결혼을 할 때 돈이 부족해 신혼집 마련 시 대출금을 받았어. 언제 다 갚을 수 있을지 모르겠어.	불안
전화를 주시면 더 자세히 논의 할 수 있습니다.	중립
아빠가 내 생일에 정말 예쁜 원피스를 사줬어. 너무 감사했어.	기쁨
그들이 여기있어 기뻐요.그들이 조직과 그들의 직업을 배우면서 상당한 기여를 할 수 있다고 믿습니다.사업을 배우기 위해 올바른 일을하지만, 현재까지의 기부금은 보너스 지불을 보증하기에 충분히 중요하지 않습니다 ...	중립
사회적으로 지지를받지 못하면 자괴감이 들거같아.	분노
길거리에서 부모님과 있을 때 친구를 마주쳤는데 당황해서 시선을 돌렸어.	당황
남편하고 애들 사이가 점점 나빠지는 거 같아. 남편은 좀 권위적이고 애들은 개성이 강한 편이야.	불안
새 직장에 취직했는데 다들 친절하셔서 너무 행복해. 직장에 대해 신뢰감도 들어.	기쁨
우리는 내일 PPA 작업을하고 있습니다.	중립
아래 링크를 클릭하면이 메모를 보려면 공유하고 싶습니다.	중립
나랑 입사 동기인 김 차장이 이번에 부장승진을 했어. 능력은 나도 김 차장 못지않은데 속상해.	상처
그것은 멋지게 들리지만 M.O.P.를위한 프로그램을 계속 만들면 짧은 것들을 사용하고 싶습니다.	중립
어제 배우자와 크게 싸웠어. 나를 너무 이해해주지 않아.	분노
내가 이번에 일을 망친 것 같아. 상사한테 말해야 하나?	불안
우리는 목요일 오후에 나옵니다.	중립
요즘 친구랑 사이가 안 좋아졌어. 내 신체장애 때문에 그런가 봐.	슬픔
나 이번에 일등 했어!	기쁨
그리고 당신은 나를 부를 것입니까?	중립
또는 오후 8시 이후 에이 문제에 대해 논의 할 수 있습니다.대화하고 싶은시기와 이와 관련하여 계속 문제가있는 경우 알려주십시오.	중립
시설에서 연료 사용과 천연 가스 분석을 이용할 수 없었지만 테스트 된 모든 장치는 허가 한도를 준수하는 것으로 보입니다.	중립
남자든 여자든 결혼 전에는 결혼에 대한 환상이 있는데 현실에서는 다른 것 같아.	분노
참석하고 싶다면 알려 주시면 티켓을받을 것입니다.	중립
토요일 7시 30 분에 저녁 식사 예약이 있습니다.	중립
여자친구랑 또 싸워서 기분이 좋지 않아.	상처
나는 지체 일 급 장애인인데 움직임이 제약이 일상적인 생활도 제약이 있어.	상처
아직 보낼 기회가 없었습니다.	중립
어제 할머니를 모시는 문제로 부모님이 싸우셨고 오늘도 우리 식탁은 찬바람이 불어.	분노
내 친구 남편이 대기업에 합격했데.	상처
은퇴하고 잠도 제대로 못 자. 푹 자고 싶은데 와이프가 자꾸 아침 운동을 가자고 깨워.	분노
또한 메일에 계정에 대한 명세서를받지 못합니다.	중립
면접에서 떨어졌는데 면접관이 나를 어떻게 봤었는지 너무 궁금해.	당황
우리 아빠는 친구가 없나봐. 항상 혼자 계시는 것 같아 기분이 좋지 않아.	상처
더 잘 작동하면 화요일 아침/이른 오후에 토론 할 수 있습니다.	중립
전에 학원을 빠졌는데 엄청 혼난 후로 빠지기가 두려워.	불안
나는 건강이 안 좋아 집에만 있어.	슬픔
선생님께서 나에 관해서 어떻게 생각하시는지 모르겠어.	상처
또한 Kicksend iPhone 앱을 설치해야합니다. 이는 iPhone에서 찍은 모든 사진과 비디오를 iPhone에서 모든 이메일로 보낼 수 있습니다.	중립
아이가 어느 정도 크니까 이제 덜 힘드네. 요즘 신랑도 집안일을 많이 하고 가족이 화목해진 것 같아서 좋아.	기쁨
I have gas on National Fuel that I could deliver into CGAS at Ellwood City on a secondary basis.	중립
나는 Causey와의 회의에서 돌아와서 오늘 6시 직전까지 구매하지 않았다 - 회의가 길지 않았다는 것은 아니었다 - Rick Causey는 늦게 달리기 때문에 우리는 시작하기 전에 그의 사무실 밖에서 발 뒤꿈치를 꽤 냉각시켰다.	중립
Scott은 John Singer 에게이 역량에서 벗어나야한다고 말할 것입니다.	중립
아직 새로운 회사 시장에 있다면, 우리는 당신이 우리 가족과 함께하기를 바랍니다.	중립
다음은 여러분과 공유하고 싶은 메모입니다.	중립
엄마랑 아빠가 자꾸 내가 하는 것마다 반대하면서 손찌검을 해. 나 너무 우울해.	슬픔
친구들이 나를 싫어하는줄 알았는데 아니었나봐.	기쁨
나 앞으로 어떻게 살아야 할지 걱정이야.	불안
요즘 결혼 준비 때문에 정말 눈코 뜰 새 없이 바빠서 스트레스받아.	불안
친구가 내가 소개해 줬던 애인에게 구타당했다고 들었어. 내 잘못 같아.	당황
최근 상품 직원 회의에서, 나는 에너지 운영에서 그 팀까지 제공 한 사람들과 프로젝트를 재고를 가져 왔습니다.	중립
사본을받는 데 유용합니다.	중립
남편이 나를 깨워서 일어나보니 밥이 차려져 있었어.	기쁨
원하는 수정 사항을 알려주세요.	중립
이번 주에 계획 문서에 대한 의견을 가지고 Brian Bloom과 함께 할 것입니다.	중립
내 아이를 돌볼 때 상상한 것과 다르게 난처한 상황이 일어나서 당황한 내가 바보 같아.	분노
이 새로운 설문 조사 Jude Spear로 설문 조사를하고 월급을 받으십시오!	중립
법률/신용 회의 목록에 상기시켜주기를 원하십니까?	중립
직장 후배가 정말 믿음직스러워.	기쁨
이것은 당신의 무료 14 일 재판이 2 일 후에 끝날 것임을 상기시켜줍니다.	중립
우리는 Netco에서의 계획된 역할과 회사가 취할 방향에 대해 귀하에게 말하고 싶습니다.	중립
위와 같이 복사하여 붙여 넣으십시오. 제출을 클릭하여 등록하십시오.	중립
내가 권고사직으로 퇴사했는데 옆집 사람이 왜 요즘은 일을 안 가냐고 묻네.	상처
HR이 당신을 위해 그것을 생산할 수없고 나는 당신에게 사본을 얻을 수 있는지 알려주십시오.	중립
그는 날개에서 득점 할 수 있지만, 작은 전진으로서의 방어적인 제한 때문에 더 많은 내부에서 플레이하게 될 것입니다.	중립
요즘 직장 구하는 게 쉽지가 않네.	불안
곧 결혼을 앞두고 있는데 친구가 나에 대한 악의적인 소문을 낸 걸 알게 되었어.	분노
시험 보는 것도 초조한데 뒤에서 불량한 친구들이 보여 달라고 압박해서 너무 불안해.	불안
엄마는 계속 결혼하라고 강요하시는데 다 귀찮아. 요즘 세상에 혼자 사는 것도 얼마나 힘든데.	슬픔
내일 임원들에게 중요한 보고가 있는데 야근 중에 친척 장례식에 참석하라고 연락이 와서 당황스러웠어.	불안
나 오늘 학교에서 다른반 친구들한테 폭행 당했어.	당황
중학교 때 진로를 미술로 빨리 선택한 덕분에 대입 준비가 한결 수월해져서 다행이야.	기쁨
예, 이전에는 Mike 's Every Mon으로 이전에 미리 메이트를 계속할 수 있습니다.8:30에 (PLS는 내 달력 Emily를 착용).	중립
To avoid any loss in service, please login, complete the payment information to activate your full service.	중립
As a follow-up to our conversation in London when you said I should bring to your attention any concerns I might have with financial trading issues, the following has recently come up as an issue here in Houston (and does so from time to time).	중립
엄마가 나 보고 도둑년이래. 너무 억울하고 눈물이 나와.	슬픔
성적이 안좋아 내가 가고 싶은 대학가기 어려워 짜증이 나.	분노
귀중한 시간을 1 분 동안 살릴 수 있고 짧은 설문 조사를 할 수 있다면 정말 감사하겠습니다.	중립
같은 반 여자애랑 진로 얘기를 했는데 말이 안 통해서 다시는 진로 얘기 안 꺼내려고.	불안
비밀번호는 삶의 사실이며 우리는 모두 나쁜 것들을 가지고 있었지만 다음 25 가지 암호 중 하나를 사용하면 전략을 다시 생각할 수 있습니다!	중립
아내가 갑자기 집안일을 도와 달라고 요구하는 데 정말 귀찮아.	분노
나는 내일 정형 외과 의사에 간다.	중립
당신이 그것을 믿지 않을 수도 있지만.	중립
친구들이 요즘 나를 괴롭혀서 너무 힘들어.	상처
그들은 착륙하고 조종사는 그루터기로 바뀌었다.	중립
내일 회의에서 나이트 나이트를 간략하게 설명 하시겠습니까?	중립
첫 번째 이메일은 내가 Burton과 Susan에게 보낸 것입니다.	중립
회사에서 내일까지 프레젠테이션을 준비 해오라 했어. 난 이런 걸 한 번도 안 해봐서 너무 긴장돼.	불안
경쟁 사회 속에서 불안장애를 앓고 있는 난 사회적 응원을 받지 못하는 비관적인 삶을 사는 것 같아.	상처
가을이 오면 돌아가신 시어머니 생각이 나.	당황
여러분, 월요일에 최대한 빨리 우리 세 사람 사이의 회의를 설정하여 토론 할 것입니다.	중립
오늘 정말 짜증 나는 일이 있었어.	분노
Lone Star, Williams 및 Apache에 대한 다음 정보를 얻으려면 다음과 같습니다.	중립
사업 탓에 외국에 계시던 아빠가 다음 달에 집으로 오신다는데 매우 기뻐	기쁨
"나는 즉시 나의 길과 ""Susman, 나의 남자, Steve Susman""의 길은 다시는 교차하지 않을 것이라고 결심했다."	중립
하나 있는 아들이 가족들 데리고 호주에 이민 가버렸어. 마누라와 나는 너무 섭섭해 요즘 밤에는 서로 대화도 없어.	분노
회사 사정상 야간에 근무자가 필요하게 됐는데 여자는 위험하다고 남자만 하라는 거야. 남자라고 희생하라는 것은 너무한 것 아냐.	상처
어제 오랜만에 일찍 퇴근했는데 아내와 아이들이 함께 즐겁게 얘기하는데 조금은 당황했어!	당황
일요일에 보자.	중립
이것을 수용하기 위해 내 달력의 나머지 부분을 저글링 해주세요.	중립
