text	emotion
조직의 선물을 주거나 자신의 삶을 조금 더 간단하게 만들려면 깔끔하게 일년 중 가장 좋은시기입니다!	중립
평생 고생만하다 살만해졌는데 이제는 또 병원 신세를 지다니 너무 억울해.	상처
포인트를 기부하려면 여기에서 다음을 수행 할 수 있습니다. $ 링크 또는 포인트를 받기 위해 데이터를 기여하려면이 페이지가 좋은 시작점입니다. $ 링크 -이 페이지는 필요한 양을 보여줍니다.다른 추가 기능에 대한 포인트 : $ 링크	중립
일주일에 크리스마스	중립
감사합니다. 회의 개발을 주도하게 요청하면서 Travis와 함께 일하십시오.	중립
Triple Lutz- 잠재적 인 매각에 대한 지원을 제공했습니다 (예 : 데이터 룸, PSA 검토, 잠재적 구매자와의 직접 협상 등).	중립
바라건대 그녀는 둘 다 만들 것입니다.	중립
FuelCell의 주식은 수요일 거래에서 $ 4.44에서 $ 72.13를 마감했습니다.	중립
도박에서 헤어 나올 수 없어서 돈을 모두 잃었어. 이제 어떡하지.	슬픔
남자친구가 그동안 나와의 약속을 하나도 빠짐없이 모두 지키고 있었더라.	기쁨
마음을 바꾸고 Pinger에게 또 다른 시도를하고 싶다면 언제든지 새로운 번호를 얻을 수 있습니다.	중립
Bill Kettlewell Client Service 대표 텍사스 전기 안정성 협의회 이메일 : kettlewell@ercot.com	중립
다른 문제가 있으면이 티켓을 다시 열어주십시오.	중립
궁금한 점이나 우려 사항이 있으시면 ipasscode@feistapps.com으로 문의하십시오.	중립
난 노후에 내 곁에 아무도 없을까 봐 걱정돼.	당황
나는 늙고 만성질환도 앓고 있는데 건강해지기 위해서 무엇을 해야 할지 모르겠어.	불안
맨날 이유 없이 나를 툭툭 치는 애들 때문에 학교 가는 게 짜증 나.	분노
친척들이 왜 자꾸 결혼 안 하냐고 무례하게 계속 물어봐서 상처야.	상처
2002 년 1 월 19 일 토요일 오후 2:00 680 Park Avenue (Corner 68th St.) Tel.	중립
노년이 되면서 거동이 불편해졌어.	불안
다음 주 휴스턴으로 여행 할 수 있도록하고 싶습니다.	중립
오늘이 발표날인데 너무 떨려.	불안
요즘 밤에 통 잠을 못 이루어.	슬픔
다 늙어서 남편과 이혼을 했는데 너무 외로워.	슬픔
1) 전체 요구 사항 위험을 입는 것에 대해 불안하다면 SDG & E의 Blunders W.R.T.	중립
10/16 주	중립
나는 건강한 노인인데 일자리 구하기가 쉽지 않아 화가 나.	분노
콜린을 학교에 등록하는 것에 대해 더 이야기 할 수 있기를 바랍니다.	중립
원하는 대학의 학과에 진학했지만 취업에는 도움이 되지 않는 공부뿐이라 당혹스러워.	불안
가해자에 대한 처분이 제대로 이루어지지 않아 스트레스 받아.	불안
지난 달 협심증 때문에 진료를 받았는데 병원비가 너무 많이 나왔어.	불안
젊었을 때 아내를 너무 핍박했나? 아내가 요즈음은 대놓고 이혼하자고 하자고 하는데 참 힘드네.	슬픔
안녕 마가렛 : 월요일 아침에 내 의견을 먼저 얻을게요.	중립
내 친구들은 돈도 많아서 너무 부러워.	슬픔
자식들에게 짐이 될까 두려워.	당황
온라인으로 구매하려면 지금 구매하십시오 >> $ 링크	중립
수십 년간 살아온 아내와 이혼하기로 했어 허탈하고 온갖 부정적인 감정들이 몰려와.	상처
거실에서 일어나다가 기립성 저혈압으로 쓰러졌어. 근데 가족들 중 아무도 거실로 지나가지 않았어.	상처
떨어진 회사에 따로 메일을 보내 탈락 이유를 묻는 것도 지겹고 짜증 나.	분노
이번에 성과급 최고 등급 받았어.	기쁨
그래서 누군가가 주소에 대해 교육받은 추측을하거나 내 오래된 카드를 참조하는 경우 왜 내 메일을받을 수 있는지 알 수 있습니다.	중립
나는 피아니스트가 되고 싶어.	당황
빨리, 유망한 것처럼 보이는 저렴한 주식을주십시오.	중립
우리는 둘 다 큰 풍부한 유형이기 때문에 오늘 저녁에 가고 싶습니까?	중립
나는 직장 동료들을 어떻게 대해야 할지 잘 모르겠어.	슬픔
잉크 플로를 즐기면 잠시 시간을내어 App Store에서 다시 평가하십시오.	중립
위는 휴스턴 클럽에서 개최되며 꽤 재미있는 행사가 될 것입니다.	중립
식구들이 모두 바빠서 수술 후에도 혼자 지내야 하니 가족이 없는 것 같고 쓸쓸해	상처
오늘 밤은 요가 밤입니다.	중립
아마도 우리는 점심이나 무언가를 가질 수있을 것입니다. 그리고 당신은 당신이하는 일에 나를 채울 수 있습니다.	중립
EE & CC가 문제를 해결하고 있다고 생각합니다.그러나 Enron의 중요성을 강조하기 위해 귀하의 전화 통화는 추가 격려를 더할 것입니다.	중립
오늘 회사 면접을 봤는데 내가 절뚝거리는 걸 보고 탈락시켰어. 이런 차별이 너무 싫어.	상처
월요일에 토론합시다.	중립
이번에 장기 이식을 받기로 했는데 그 사람이 갑자기 연락을 끊었어. 어떡하지?	불안
남자친구가 바람을 피웠어.	상처
오늘 카페에 갔다가 옛날에 좋은 감정을 가지고 있었던 오빠를 우연히 만났어.	불안
우리 팀의 마케팅으로 회사 제품이 유명해졌어. 팀의 노력으로 회사에 이익을 준 것 같아 뿌듯해.	기쁨
이는 육상 및 현장 커뮤니티에서 강력한 지원을 받고 있으며 휴스턴이 경쟁 도시보다 가장 중요한 이점 일 수 있습니다.John은 전 세계 육상 및 필드에서 가장 중요한 사람들로부터 Astrodome 육상 및 필드 시설의 강력한지지를 제공하는 10 분짜리 비디오를 가지고 있습니다.	중립
언제든지 전화를 걸어 언제든지 논의하십시오.	중립
PR -Dorie Hitchcock을 통해 관리하십시오 - 승인 프로세스의 일부로 의제가 필요합니다.	중립
Janet, 메시지가 전달되고 향후 혼란이없는 많은 증인이 이용할 수 있도록하는 것이 귀하의 개인적인 관심사 일 수 있습니다.	중립
여자친구와 헤어져서 정말 슬퍼.	슬픔
의사가 병을 고치기 위해 식습관을 바꾸어야 한다고 단호하게 말했지만 너무 힘들 것 같아.	분노
단일 수표를 보내 주셔서 감사합니다.	중립
나 요즘 고민거리가 생겼어.	기쁨
계정을 취소하려면 : $ link로 이동하십시오.	중립
키가 작아서 친구들이 나를 무시할까봐 항상 키높이 신발을 신는데 이게 알려질까 봐 두려워.	불안
나는 당신의 의견을 듣고 기쁩니다.	중립
받은 편지함으로 배달되도록 events@communications.onekingslane.com을 주소록에 추가하십시오.	중립
공부만 강요하는 부모님 때문에 너무 화가 나.	분노
내 부서와 동기 부서가 은근히 경쟁을 해서 동기보다 열심히 하는 것을 보이려고 야근을 했어.	당황
집에 갈 때 괴롭힘당하지 않도록 같이 가주겠다는 친구가 생겨 너무 기뻐.	기쁨
그는 유틸리티의 모든 부서가 채권자 명단에 대한 정보를 모으고 5 월 중순까지 파산 판사 Dennis Montali에 제출되기 위해 몇 주를 보냈다고 말했다.	중립
Enron은 DWR과 적극적으로 논의하여 가능한 빨리 전력 구매 계약을 체결하려는 목표로 계약 조건을 설정하고 있습니다.	중립
거래처 직원이 결재 대금을 가지고 잠적했어.	분노
와인을 마시는 것을 즐기십시오 (최근 시라가 있었음). 만나기를 기대하십시오.	중립
수능이 얼마 남지 않았는데 정말 후회가 돼.	당황
내가 건강이 나쁜 데다가 아직도 전세를 면치 못하고 있으니 누구도 이해하지 못해.	분노
나는 이제 곧 빈털터리가 되고 말 거야.	분노
요즘 자녀들과 사이가 안 좋다는 부모들이 많던데 우리는 괜찮은 것 같아.	기쁨
우리는 배달 가스를 판매하기 때문에 영수증 및 배송량은 동일해야합니다.	중립
남편이 아픈 곳이 많아져 돌보기가 힘이 들어.	상처
전화하려고했지만 오늘 당신의 음성 사서함이 엉망이된다고 생각합니다.	중립
이 지원은 런던에서 열린 정상 회의 후 세계 은행의 도움으로 전적으로 효과적이었습니다. 국제 글로벌 표준으로 경제가 변동하는 재무 안정성 문제에 대한 재무 분석에 대한 재무 분석에 관한이 지원.	중립
나 짜증이 나서 견딜 수가 없어.	불안
그렇지 않다면 Ryan의 사슴에 오시고 싶습니까?	중립
나는 이제 아무것도 할 자신이 없어. 지쳤다.	분노
퇴직을 하니 쓸모없는사람이 된것같아.	상처
지난날 건강에 소홀하고 가정에도 소홀해서 자신이 원망스럽네.	당황
내가 위암에 걸렸는데 이 위암이 다른 장기로도 전이 됐대. 인생이 너무 허무해.	상처
아내가 건강에 관심이 많아서 나를 잘 챙겨 줘. 아내 덕분에 내가 체력을 유지하는 것 같아.	기쁨
은퇴 후에 어떤 직업에 도전할지 고민하는 일이 너무 설레고 신이 나.	기쁨
다니던 회사가 부도나서 한참 힘들었는데 주변 지인들 덕분에 다행히 예전만큼은 수입이 생겼어.	기쁨
오늘 너무 불쾌한 일이 있었어.	당황
이번에 검진을 받았는데 디스크가 너무 안 좋다고 살을 빼야 한대. 어떡하지?	불안
가고자하는 진로가 금전이 많이 드는 분야라 고민이야.	상처
받은 편지함으로 배달하려면 quibids@win.quibids.com을 추가하십시오.	중립
당신은 무엇에 집중할 것입니까?	중립
커뮤니케이션 전선에서, 우리는 그와 날씨 그룹과 매주 전화를 걸어 우리 모두가 같은 페이지에 있는지 확인하고 우리가가는 곳과 속도를 높일 수 있습니다.	중립
아이가 공부는 못하지만 운동은 되게 잘해서 다행이야.	기쁨
다음은 우리가 좋아할 것이라고 생각하는 책이 있습니다. 우리가 만나고 싶은 독자 몇 명과 함께.	중립
기회가되면 저에게 전화주세요.	중립
얼마 전에 옹알이를 하기 시작하더니 오늘 아침에 드디어 나한테 아빠라고 말했어! 정말 기뻐!	기쁨
너무 비통하다.	슬픔
애인이 인기가 많아서 걱정이야.	불안
직접 또는 전화로 제공되면 내일 당신과 논의하고 싶습니다.	중립
남자친구와 헤어진 지 꽤 오래 되었는데 요즘 들어 종종 전 남자 친구가 그리워.	당황
처음 만나는 사람들 앞에 서면 어떤 말과 행동을 해야 할지 하나도 모르겠어.	슬픔
딸이 손에 가시가 박혔다고 빼달라고 나한테 떼를 써.	분노
갑자기 시력을 잃어서 하던 일을 그만두게 됐어.	불안
병원에서 건강검진 결과가 나왔는데 나 당뇨래.	슬픔
애들만 키우면서 살았더니 내 삶이 없는 것 같아서 허무해.	불안
이번에 팀장님이 간단한 조사 업무를 부탁하셨는데 내가 잘못 처리했어. 너무 절망적이야.	당황
포럼이 시작되기 전에 약간의 변화가있을 수 있지만,이를 통해 다루어야 할 주제와 그룹을 다루는 다른 연사에 대한 좋은 아이디어를 제공합니다.	중립
대학입시 방법이 자꾸만 변경되서 정말 짜증나!	슬픔
수신하려는 메시지를 받으려면 이메일 환경 설정을 업데이트하십시오.	중립
회사가 오지로 발령 나서 가족들과 떨어져 지내야 해서 슬퍼.	슬픔
지난달부터 아들 내외와 같이 살고 있는데 며느리가 날 싫어하는 것 같아.	당황
오늘 부모님이 맛있는 음식을 사 오셨어!	기쁨
참가자를 추가하면 제안 목록도 업데이트됩니다.	중립
오늘도 회사에서 너무 힘들었어.	분노
내년 초에 아들이 결혼하는데 집도 못 해 주고. 참 속상해.	당황
마누라가 이혼하재. 이제 밥 차려주는 게 지긋지긋하대.	상처
특정 날짜, 호텔 및 기타 정보는 412-279-9298로 전화하거나 http://www.pgsenergy.com/schedule.html을 방문하십시오.	중립
일을 마치면 10 월 초에 후속 회의를 설정하려고 노력할 것을 제안합니다.	중립
평생 일만 해와서 돈관리는 아예 못하는 편인데 걱정이네.	불안
의사선생님께 건강상태를 들었는데 아내에게 말을 해야 할 것 같아.	불안
친한 친구 장례식에 갔다왔어.	불안
NeatConnect의 Wi-Fi 기능을 사용하면 용지가 어디에 있든 적용 할 수 있습니다.	중립
아내가 건강할 때 해외여행 한번 보내주고 싶었었거든. 그런데 그러지 못했지.	분노
인증을 받으려면 증언을 제출해야합니다!	중립
문 닫은 식당 주인을 우연히 만나 잠깐 이야기를 나눴는데 코로나 사태로 식당 문을 닫아 생활이 힘들다고 하더라.	당황
친척 조카가 얼마 전에 하늘나라로 갔어. 아직 너무 어린 아기였는데.	슬픔
이 360 개의 네트워크 거래에 참여하는 것에 대해 생각해야한다고 생각합니다.	중립
나는 내가 말한 한 가지 경고는 Kristin이 그 팩에 있어야하는 것처럼 보이게하는 조직의 다른 부분에서 가져온 다른 이름이 있는지 기다려야한다고 생각합니다.	중립
내가 왜 친구들한테 따돌림을 당해야 하는지 정말 모르겠어.	분노
또한 면제 서명에 서명하는 40 명 이상의 사람의 경우 40 세/40 세 미만의 사람에 대한 인구 조사 데이터와 제목 및 나이를 제공해야합니다.	중립
우리는 어젯밤 Mike와 이것을 논의했습니다.	중립
그녀는 보트 표시와 관련하여 이야기하는 사람이 아닐 수도 있지만 올바른 연락을 할 수있을 것입니다.	중립
요즘 회사에서 자주 야근해서 하루하루가 고단해.	불안
1 월 말에 Rick과 Jeff와 함께 앉을 것으로 예상됩니다. 1 월 중순까지 내 검토를 위해 패키지를 사용할 수 있습니다.	중립
http://wwwapp.us.dell.com/us/en/ordstat/index.asp를 클릭하여 주문 상태를 확인할 수 있습니다.	중립
이런 모의고사 결과가 나왔는데 저번보다 등급이 낮아졌어.	분노
요즘 직장에 일이 너무 많아서 힘든데 돈은 벌어야 해서 퇴사도 못 하고 스트레스야.	슬픔
만성질환으로 삶의 전반적인 모든 것에 흥미가 없어지고 있어. 게다가 우울증까지 왔어.	불안
친구들은 다 취직해서 잘살고 있는데 나는 왜 이럴까. 열등감을 느끼게 돼.	당황
친구랑 놀러 가는데 엄마가 용돈도 많이 주셨어. 너무 기뻐.	기쁨
명절이 곧 다가와서 걱정이야.	불안
당신은 상황에서 환상적인 일을했고 시간 제약을 주었습니다.	중립
나는 다른 날도 작동하게 할 수 있습니다.	중립
2013 년 1 월 16 일부터 2013 년 1 월 18 일까지 우리 게임을 로그인하면 추가 50 개의 자동 스핀을 얻을 수 있습니다 !!!서둘러서 잡아라!	중립
오늘도 야근이라 너무 지치고 피곤해.	분노
요새 친구랑 사이가 좋지 않아서 스트레스를 받아.	당황
사람들과 어울릴 때도 돈이 들어 그 누구도 만나고 싶지 않아.	불안
얼마 전 친구가 괴롭힘을 당하고 있었는데 도와주지 못해서 후회가 돼.	슬픔
이것은 유료 설문 조사를 시작하기에 완벽한시기이며, 나는 당신을 우리의 최신 회원으로 환영하기를 기대합니다!	중립
난 진짜 왜 태어난 걸까.  나 뜻대로 안 움직이는 내 몸이 너무 싫다.	슬픔
포럼을위한 드레스는 캐주얼하므로 자유롭게 해보십시오.	중립
경험에 대한이 설문 조사를 완료하십시오.	중립
아까 동생이 태어났는데 아빠가 우셔가지고 놀랐어.	불안
변경 사항이 불편을 끼쳐 드린 경우 Amazon 기프트 카드를 보내 드리고 싶습니다. 피드백에 답장하거나 (855) 962-3621로 전화하십시오.	중립
새로운 문제가 발생하면 Mark Taylor를 복사하십시오.	중립
다시 말해, 직원이 우리의 경쟁 업체가 모르는 Enron 내에서 무언가를 개발하기 위해 노력하고 있다면 ExpertFinder는 해당 데이터/전략을 제공 할 수 있습니다.	중립
내 실수로 회사에 큰 손실이 생겨서 해결해야 하는데 수중에 그만한 돈도 없고 초조해.	불안
직장 때려치우고 싶어. 다니기 싫어.	슬픔
1 분이되면 CO OP 용어 시트 (자산 관리자)에 대한 마지막 첨부 파일에 대해 논의해야합니다.	중립
오늘 밤 습기를 살펴보십시오.	중립
브렌트에게 11 월 20 일 월요일에 휴가를 갈 것임을 알려주십시오.	중립
경제적으로 여유가 있으니 아픈 것만 빼면 삶이 너무 즐거워.	기쁨
2011 년 4 월 2 일 : 비옥 한 날 1 -EST 기존 날짜 12/18/11 03 : 비옥 한 날 2- est 기존 날짜 12/18/11 04 : 비옥 한 날 3- EST 기존 날짜 12/18/11 05 : 비옥 한 날 4-배란 할 가능성이 가장 높습니다 06 : 비옥 한 날 5- EST 기존 날짜 12/18/11 18 : 기간 1 일 19 : 기간 2 일 20 : 기간 3 일 21 : 기간 4 일 22 : 기간 5 일 23 : 기간 6 일 24 :기간 7 일	중립
요즘 진로에 대해 고민이 많은데 부모님이 너무 나에게 무관심하셔서 슬퍼.	슬픔
I am going to get fucked on broker gifts this X-mas.	중립
보고 싶지만 지원을받는 데 시간이 걸립니다.	중립
혼자 매일 도서실에서 공부를 하니깐 외롭다.	당황
문제는 구매자가 고용 한 직원의 급여 (Enron 퇴직 계획의 영향), 매각 된 직원에 대한 기타 혜택 (비 투자 주식 옵션, 보험, 휴가 등), 매각 프로세스, 퇴직 의무 지불, 가능한 재배치 등이 포함됩니다.	중립
날 항상 괴롭히던 동료들이 드디어 회사에서 잘렸어. 익명 소리함에 투고하길 잘했어.	기쁨
논의하고 싶은 의견이나 질문이 있으시면 (713) 853-3399로 저에게 전화하여 (713) 345-4079 또는 Bob Shults (713) 853-0397로 전화하십시오.	중립
왕따 당해서 전학을 왔는데 괴롭히는 애들이 언제 날 찾아올까 매번 너무 두려워.	불안
벤, 이에 대한 표준 형태가 있어야합니다. 캔디스를 확인하십시오.	중립
우리가 어제 논의했듯이, Laird와 나는 연설을했고 우리는 프레젠테이션이 목요일에 좋다고 생각합니다.	중립
더 젊었을 때 돈이라도 많이 저축해놓을 걸 그랬어. 너무 후회가 돼.	불안
언제 논의하고 싶습니까?	중립
크리스마스 전 마지막 전화	중립
우리는 어느 날 밤에 사용할 수 있기 때문에 선택을 당신에게 맡깁니다 ...	중립
12 월이고 우리는 다시 잠을 잘 수 있습니다 : Nanowrimo 2013	중립
이것은 100% 합법적 인 기회입니다.	중립
취업이 너무 안 돼서 힘들어.	상처
내 시스템은 Ena가 Canajoharie에 130,000을 전달했으며 5,000 명은 언젠가는 Tenn-Wright에 전달했음을 보여줍니다.	중립
그러나 설문 조사에서 분명히 알 수 있듯이,이 부문들은 모든 종류의 삶을 보여주고 있습니다.	중립
딸이 공부를 포기하고 자격증을 따서 개인 사업을 하고 싶다고 하니 너무 당황스러워.	당황
지금 먹는 약이 내성이 생길수도 있다는데 계속 먹어야 할지 모르겠어.	당황
사람도 안 뽑고 취업이 너무 힘들어. 이렇게 하다가는 취업을 못 할 것 같아서 좌절스러워.	분노
나 이혼하고 싶어.	슬픔
아내와 형이 최근에 하늘나라로 떠났어. 그렇게 빨리 보낸 게 다 내 잘못 같아.	분노
매일 헬스장을 다녔는데 말도 없이 문을 닫아버려서 당혹스러워.	불안
이 자료에 대해 더 자세히 논의하려면 주저하지 말고 도움을주기 위해 할 수있는 다른 일이 있으면 주저하지 마십시오.	중립
경비라는 직업이 쉽지 않아.	슬픔
어제까지만 해도 연락이 잘 됐던 자식이 연락이 안 돼.	불안
우리는 불편을 끼쳐 드린 것에 대해 진심으로 사과합니다. 이로 인해 귀하와 귀하의 사용자가 가능한 빨리이 서비스를 복원 할 것으로 예상됩니다.	중립
참고로, 금요일에 Ozzie와 Heather와 다른 회사에 대해 마지막으로 논의했을 때, 그들은 다른 회사에 FCE 또는 CRRA에 대한 기밀 유지 의무를 위반하지 않고 일반적인 지위를 알리기 위해 전화 할 계획이었습니다.	중립
이 논의를 다음과 같은 점으로 설정하겠습니다. a) 우리는 아르헨티나를 빠져 나가지 않습니다.b) 비즈니스 기회에 맞게 전체 조직을 올바른 크기로 만들어야합니다.c) 가능하다면 상업용 전선에서 더 큰 생산성, 팀 작업 증가, 평평한 조직 차트, 실시간 의사 결정 및 더 큰 의사 소통을 생성하기 위해 지적 자산을 한 위치로 통합하고 싶습니다.d) 아르헨티나에있는 사무실을 포함한 두 시장 모두에서 강력한 입지를 계속 유지해야한다.그리고 e) ESA에 대한 모든 비상업적 활동을 상파울루로 통합하고 싶습니다.	중립
초등학교 때 은사님을 얼마 전에 뵈었어. 어른이 돼서 은사님을 만나니 감회가 새롭고 기쁘더라.	기쁨
고객 상담 업무를 나보고 혼자 하래. 나 혼자 이 업무를 감당하라니 당황스럽고 외로워.	당황
오늘 부친이랑 싸워서 기분이 좋지 않아.	불안
부모님이 매일 싸우셔.	불안
오늘 산부인과에 검진받으러 가는데 며느리가 같이 가준다 하는데 좀 부끄러워	당황
나도 친구들과 좋아하는 연예인에 대해 이야기 하고 싶은데 그럴 수 없어서 괴로워.	상처
학교에서 아이들이 나랑 말을 안해. 없는 사람 취급을 해. 나 혼자 섬에 버려진 것 같아.	상처
Matagorda Bay 20 또는 멕시코만의 낮이나 밤 항해도 이용할 수 있으며 닉 선장은 헬름에 이용할 수 있습니다.	중립
정말 고마운 일이 있는데 감사한 마음을 어떻게 보답해야 할지 모르겠어.	기쁨
병을 앓으면서 친하게 지내던 동호회 사람들과 멀어졌어.	상처
도무지 직장 상사의 말을 이해할 수가 없어.	당황
아들이 전화가 왔어. 사업이 부도가 났다는 거야. 머리가 너무 아프고 심란해.	슬픔
요즘 취업이 잘 안 돼서 너무 스트레스를 받아. 이 길이 맞나 하는 진로에 대한 믿음도 흔들리고.	불안
건강검진을 했는데 아무 이상이 없다고 해서 마음이 편안해.	기쁨
당신이 이것을 얻는다면 w/b.	중립
오늘 약속에 친구들이 한명도 나오지 않았어.	상처
자식이 내게 좋은 주식 종목이라며 추천해 줬어.	불안
나이가 드니 몸 구석구석 안 아픈 곳이 없어.	분노
그리고 당신 근처의 극장에 곧 올 것입니다 : 성경의 제작자들의 하나님의 아들, 2014 년 2 월 28 일 극장을 강타 할 예정인 성서-시리즈로 변한 모션-픽처 사건을 지켜보십시오!	중립
그래도 들어갈 수 없었습니다.	중립
나이가 들면서 신체장애가 생겼어.	분노
나 너무나 긴장이 되어 못 견디겠어.	불안
친척들 모임에서 성적 이야기가 나온 후로는 부모님이 모임에 나를 데리고 가지 않으셔. 너무 속상해.	상처
본부장님께서 나에게 금고 키를 맡기셨어.	기쁨
나는 당신의 인생이 매우 복잡하다는 것을 알고 있으며 점심, 저녁, 영화 등에 갈 시간과 성향이 있다면 분명히 가능합니다.	중립
당신이 저에게 전화 할 수 없다면, 나는 당신에게 월요일 상황에 대한 짧은 메모를 보내 드리겠습니다.	중립
매일 아침 옷을 고르는 데만 거의 한 시간을 허비해. 남의 시선을 병적으로 신경 쓰는 것 같아서 고치고 싶어.	당황
다음은 입찰 주간 스프레드 시트 배포에 추가 할 두 가지 주소입니다.	중립
Simplenote Premium에 대한 자세한 내용은 다음을 참조하십시오.	중립
같은 반 친구가 나를 너무 괴롭혀서 막 눈물이나.	슬픔
병원에서 나 살날이 얼마 남지 않았다고 하네.	분노
능력 없이 자식에게 도움 요청하는 내가 너무 부끄러워.	당황
나는이 이야기를 읽고있다. 나는 당신이 그것을 원한다고 생각한다!	중립
따라서 Kevin은 전환에 대해 논의하기보다는 가능성으로 반응하고 흡수해야했습니다.	중립
허리디스크 때문에 공사판도 못 나가고 먹고 살기 어려워. 아픈 것도 서러운데.	슬픔
몸이 아파 자녀들에게 경제적으로 미안한 마음이 큰데 자녀들은 전혀 내색을 하지 않고 있어.	기쁨
상담 세션은 귀하에게 귀하의 옵션을 제공하는 데 필요한 정보를 제공하고 재무 개선에 도움이되는 실행 가능한 솔루션을 논의했습니다.	중립
뇌수술 때문에 이십 년이나 같이 살아온 아내 얼굴이 기억이 안 나.	상처
이 가상의 도시의 미국 주를 선택할 수 있습니까?	중립
이번에도 취업을 하지 못할 것 같아서 눈물이 나.	슬픔
그들은 또한 매번 주어지지 않고 심사 위원이 특히 업적을 인정하기를 원할 때만 두 명의 특별 심사 위원 상을 수상했습니다.	중립
