text	emotion
이제 우리는 다른 뉴스 제작 문제 인 순 중립에주의를 기울이고 싶습니다.	중립
나에게 조울증이 있대. 가족들이 얼마나 힘들었을까?	슬픔
관절염이 있어서 평소 다리가 많이 불편해.	기쁨
Morgan McKeel은 za☪h @zacharydupuis 관계를 리트 윗했습니다.	중립
구매를 보내 주시겠습니까?	중립
엄마가 재혼하실 거라는데 나는 어떻게 해야 할지 몰라 너무 불안해.	불안
아들이 힘들다고 고민을 털어놓은 적이 있는데 내가 너무 대수롭지 않게 생각 했었나 봐.	슬픔
할머니 집 마당에서 다 같이 고기를 구워먹었는데 난 진짜 행복했다.	기쁨
산후 우울증이 너무 심해서 아이에게 안 좋은 영향을 내가 미치는 거 같아.	분노
오늘 면접을 보고 왔는데 대답을 잘 못 해서 나 자신한테 실망스러워.	슬픔
내 친구는 항상 약속 시각에 늦게 나와서 짜증 나.	분노
요즘 친구들 만나는 게 겁이 나.	불안
나는 누군가가 전화하는 메시지를받는 것을 확신하지 못한다!	중립
빵을 만드는 일을 하고 싶었는데 냄새를 잘 맡지 못하는 내가 제빵사가 되면 안 되겠지?	분노
오늘 같은 밤은 더 우울해. 남편이 더 많이 보고 싶어.	슬픔
나 자신이 싫을 때는 산에 가. 내가 너무 미워서 힘들 때 고통을 주는 거지.	분노
금요일에 우리는 식당에서 만날 수 있습니다.	중립
연금 수령액을 오늘 계산해봤는데 생활하기에 조금 빠듯할 것 같아.	불안
내가 가진 병 때문에 당분간은 병원에만 있어야 해서 답답해.	당황
언제 A & M/UT FF Tourney에서 연습을 시작할 것인가 - 팀을 모으고 연습을 시작해야합니다.	중립
나는 점심과 이메일에서 돌아 왔고 지금 그것을 원한다!	중립
토요일은 좋습니다.	중립
우리는 함께 모여 Dave와 토론해야합니까?	중립
나는 의대를 가고싶은데 등록금이 비싸다고 해서 걱정이야. 우리집은 그런 형편이 안되거든.	상처
또한 Redmond와 Thompson에 따르면 Reeding & Bates와의 토론을 시작하는 것이 좋습니다.	중립
돈 때문에 구역질이 날 지경이야.	분노
나는 왜 다른 친구들이 매점이나 산책과 같이 다 같이 움직일 때같이 놀지 못할까?	불안
우리의 계획을 방해 할 수있는 합병증을 피하기 위해이 비즈니스를 기밀로 유지하십시오.	중립
남편이 어느날 느닷없이 내 머리카락을 쥐고 흔들어서 머리카락이 얼마나 많이 뽑혔는지 몰라.	분노
보조금 외에도 학교로 돌아 오는 데 도움이되는 다른 재정 지원 옵션이 있습니다 : 대출, 장학금, 업무 연구 프로그램 등.	중립
우리 가이 트렌드를 좋아하는 이유 : 운동화를 위해 예약 할뿐만 아니라, Laced-Up Looks는 여름에서 가을으로 스타일을 전환하는 쉬운 방법입니다.	중립
FERC 수요일은 캘리포니아 전력 거래소의 가격 설정 메커니즘을 메가 와트 시간당 $ 150로 제한 할 것을 제안했습니다.	중립
dupree diamond @dupreediamond2 @ben_wiggin이 내려 갔다.	중립
주말을 기대합니다.	중립
좋지 않은 성적 때문에 면접에서 계속 성적으로 공격을 받아.	상처
이번에 들어온 후임이 참 싹싹해.	기쁨
내가 매번 데이트 비용을 대느라 다른 생활은 할 수 없는 지경이야.	상처
내 친구랑 남자친구랑 바람났어. 끔찍해.	상처
2012 년 8 월 8 일, 밤 : $ 링크	중립
남자 친구가 요즘 예민해.	불안
손주를 안아보고 싶지만 병상에 누워 있어서 움직일 수가 없어서 너무 슬퍼.	슬픔
한쪽 팔을 못쓰게 된 이후로 모든 일이 자신 없어. 그때의 실수만 아니었다면 뉘우치게 돼.	당황
허리 통증 때문에 집에만 있어야 돼서 고립된 것 같아.	상처
나랑 제일 친한 친구가 내 비밀을 다른 사람에게 말하고 다녔어. 어떻게 그럴 수가 있지?	상처
상사가 올해 내 승진을 약속했는데 기대했던 승진 명단에 내가 없어서 배신감을 느꼈어.	상처
앨리슨, FedEx 또는 Fax (505) 627-8172를 통해 가지고있는 것을 더 잘 보내십시오.	중립
또한 NWPL의 도움으로 지명의 80% 만 얻을 수있었습니다.	중립
그녀는 필요한 정보 및/또는 지원을 제공 할 수 있으며 미디어 노력을 지시하는 PR 회사 인 Edelman과 연락 할 수 있습니다.	중립
이 자금은 내일까지 재무 또는 고용 검증없이 귀하의 계좌에 직접 입금 할 수 있습니다.	중립
금요일 오전 10시에 다시 시도 할 수 있습니까?	중립
남편이 외도를 하는 것 같아서 초조해.	불안
몸이 불편한 친구에게 상처를 줬어. 배려 없이 행동한 내가 후회돼.	분노
요즘 내 직장에서 업무가 너무 많아.	분노
아들의 성적이 자꾸 떨어지는 게 다른 이유가 있는 게 아닐까 의심돼.	상처
이제 노후준비를 걱정할 나이가 되었네.	기쁨
결혼해서 출산을 할 생각하면 정말 걱정스러워.	불안
이 제안은 언제든지 만료 될 수 있으므로 서두르고 지금 참여하고 싶을 수도 있습니다!	중립
오후 1시 서해안 시간은 사람들이 캘리포니아 주민 에너지 정책을위한 캘리포니아의 비용을 어떻게 평가할 수 있는지에 대한 간단한 킥오프 토론을하기 위해 노력합니까?	중립
더 이상 차도의 희망이 없는 내 건강상태에 화가 나.	당황
당신과 크리스틴이 함께 모이게되어 기쁩니다.	중립
우리는 일반적으로 매우 완전한 의제를 가지고 있지만 정보를 남겨두면 멈추고 인사 할 것입니다.	중립
11 월 5 일 휴스턴에 있으면 산책을 위해 우리와 함께하는 것을 즐길 것입니다.	중립
내가 계속 몸이 아파서 그 일 때문에 요즘 부모님이 예민하시더니 다투셨어. 정말 울고 싶어.	슬픔
이번 주에 이야기 할 수 있다면 좋을 것입니다.	중립
궁금한 점이 있거나 추가 지원이 필요한 경우 저희에게 연락하십시오.	중립
미래의 이메일 배송을 보려면 mailto를 추가하십시오 : specials@papajohns-specials.com	중립
손녀가 휴가를 받고는 내내 내 말동무도 해 주고 간별도 해 줬어.	기쁨
Stacked Articles와 같은 데이터를 검색하려면 temo@factyle.com으로 이메일을 보내주세요.	중립
지난번 지원한 회사에서 탈락이란 소식을 들었어.	슬픔
부모님의 간섭 때문에 울었어. 뭐든 다 내 우울증 때문이라 치부해버리셔서 슬퍼.	슬픔
마흔네 살이 되고도 휠체어에서 못 벗어나는 내가 싫어. 이것 때문에 일에도 지장이 있어.	분노
현재 Hellowallet 계정에 구축 된 거래 내역이 충분하지 않은 경우 걱정하지 마십시오. 올해 도울 수있는 방법이 여전히 많이 있으며 내년에는이 역사가 충분합니다.검토.	중립
숙소에서 빠져나와 아내와 단 둘이 밤바다를 보러 나왔어.	기쁨
이기고 싶다면 지금 검색하십시오!	중립
내가 너무 소심해서 말을 잘 못하니까 모두 나한테 불친절하게 대할 것 같아.	당황
유효한 제외 양식 또는 이의 제출 방법에 대한 자세한 정보는 결제 웹 사이트를 방문하십시오.	중립
우리 부장이 다들 열심히 일 하는데 김 대리에게만 부드럽게 대해줘서 너무 질투가 나.	상처
배달 지점은 Rayne입니다.	중립
내가 잘못한 것이 아닌데 내가 잘못했다고 하는 게 옳은 일일까?	상처
야간과 주간을 번갈아 근무하다 보니 컨디션이 회복이 잘 안돼서 정신이 혼란스러워.	당황
내가 걔를 좋아한다는 사실 때문에 교실이 시끄러울 지경이야. 벗어나고 싶어.	당황
생일에 엄마가 최신 스마트폰을 사 줬어. 정말 기뻐.	기쁨
그러나 다음 주택 파이낸싱 거래에 대해 Amerisave를 명심하고 왜 많은 고객이 향후 주택 구매 및 리파이낸스를 위해 우리에게 돌아 오는지 확인하십시오.	중립
우리 집은 왜 이렇게 가난한지 모르겠어. 나는 저축이 왜 힘든 거지.	상처
주말에 더 많은 시간을 보낼 것입니다. 문제가 있으면 월요일에 전화 할 것입니다.	중립
가족관계가 구역질이 나.	분노
오늘 밤 당신과 이야기하십시오.	중립
수능 끝나면 홀가분하게 친구들이랑 여행가고 싶었는데 재수하게 되었어.	불안
지금 사귀는 남자친구는 나에게 큰 믿음을 줘.	기쁨
아빠가 술에 취해서 화장실에 또 토를 해놔서 못 들어가겠어.	분노
남자친구가 시도 때도 없이 연락해. 솔직히 성가실 지경이야.	분노
다음 프로그램에 참석하는 참가자에게 피드백을 제공하도록 요청 받았습니다.	중립
나이가 점점 많아지니까 결혼을 할 수 있을지 모르겠어.	슬픔
일이 많아서 계속 일만 하는 남편이 안쓰럽고 걱정돼.	불안
오늘 밤 전화하면 모든 끔찍한 세부 사항을 알려 드리겠습니다.	중립
열심히 다니던 직장에서 이제 막 퇴직했는데 모아둔 돈 한 푼 없는 내가 너무 안쓰러워.	슬픔
비록 나는 암이지만 남편과 아들 덕분에 수술비를 걱정하지 않아도 되는 것이 다행이야.	기쁨
퇴원 후 집에서 아내가 몸을 씻겨주는데 살이 빠져서 뼈가 앙상한 내 몸이 보기 싫네.	당황
친구들이 내가 바쁠 것 같아서 자기들만 여행을 간다고 하는데 나에게 의견을 물어보지도 않고 정한 여행 계획을 들으니 소외감이 느껴졌어.	상처
천식이 심해져서 건강이 더 안 좋아졌어. 정말 속상해.	불안
받은 편지함으로 전달하려면 주소록 및 안전한 목록에 altifications@socialreader-mail.com을 추가하십시오.	중립
가해자들한테 줄 돈이 모자라. 오늘도 맞을까 봐 너무 무서워.	불안
내 성적이 자꾸 떨어지니깐 부모님이랑 자꾸 싸우게 돼.	불안
여자 아이돌의 팬이 되었는데 가족들에게 말하기 부끄럽네.	당황
마스터 회사 계약이 없으면 확인과 함께 일반 이용 약관을 발송합니다.	중립
경기 후 공원에서 무료 점심이 제공됩니다.	중립
David Hunt 및 Me Tomorrow와의 전화 회의를받을 수 있습니까?	중립
So, in order to correctly estimate our economics, I changed the price on the delivery to reflect how the deal will settle.	중립
메리 솔름 슨 (Mary Solmonson)과 제임스 스크 리브 너 (James Scribner)와 함께 중간 및 백 오피스 서비스를위한 상용화 기회에 대해 높고 낮고 예상되는 사례를 범위화하기위한 모델 작업을 시작하고 싶습니다.	중립
시도 때도 없이 연락해서 불평만 늘어놓는 친구 때문에 너무 성가시고 지쳐.	분노
행복한 월요일	중립
나는 당신이 우리와 함께 할 수 있기를 바랍니다.	중립
우리의 QCF 감독은 세미나 후 점심을 먹을 것입니다.	중립
옷을 시간 안에 잘 만들어내야 하는데 손이 불편해서 집중할 수가 없어 옷을 못 만들겠어.	불안
더 이상 scoop.it로부터 이메일을받지 않으려면 구독을 취소 할 수 있습니다.	중립
요즘에 느끼는 감정에 너무 괴롭네.	분노
이번 주말에는 모든 멀티 플레이어와 팀 경기에서 더블 XP를 얻을 수 있습니다.	중립
진로 걱정에 잠이 오지 않아. 밥도 맛이 없고 모든 것이 마비된 느낌이야.	슬픔
친구가 준 건강식품을 먹고 몸이 마비돼서 병원에 다녀왔어.	불안
아이들을 학교에 보내고 남편과 영화를 보러 왔어.	기쁨
23과 나와 같은 서비스는 사람들이 게놈을 분석하여 자신을 더 잘 이해할 수 있도록합니다.	중립
라이브 전화 인터뷰에서 사용 가능한 시간은 오후 5시 30 분 CT, 오후 6시 30 분 CT 및 오후 7시 30 분 CT입니다.	중립
나는 여자친구를 충분히 사랑해줬다고 생각했는데 여자친구가 내가 더 사랑해주길 원해.	불안
아이들이 날 무시해.	분노
월급이 너무 적어서 속상해.	슬픔
지연에 대해 유감스럽게 생각하지만, 우리는 더 많은 워크숍 평가를 받기 위해 참석자들의 워크숍에 대한보다 완전한 평가를 제공 할 수 있도록 기다리고있었습니다.	중립
선생님이 점수가 좋은 학생들만 진로 상담을 열심히 해주셔. 좋은 선생님이라고 생각했는데 진짜 환멸을 느끼고 있다니까.	슬픔
친구가 미래를 위해 준비한다며 학원도 다니고 성적 관리도 하고 운동도 하는데 그렇게까지 해야 하나 싶어.	슬픔
이번 수행평가에서 만점을 받았어. 너무 기뻐.	기쁨
선생님은 만날 공부 잘하는 애들만 챙겨. 오늘도 내가 말 거는 건 무시해서 속상했어.	상처
친구들 사이에서 따돌림받는 친구와 최근 싸웠는데 화해하려고 하니 참 짜증 나.	불안
우리 엄마 아빠는 형에게만 모든 걸 지원해.	상처
그녀가 할 때 정말 화를냅니다.	중립
애들이 어렸을 때 조금만 잘못해도 엄청나게 야단쳤어.	당황
좋아하는 애한테 고백했는데 내 성적이 너무 안 좋아서 만나기 어려울 것 같대. 너무 슬퍼.	당황
따돌림 때문에 힘들었는데 새로 사귄 친구들은 더 이상 나의 말을 무시하지 않아서 기뻐.	기쁨
Enron이 결국이 거래에 참여하기로 결정한 경우, Dennis가 이미 만든 계약과 약속은 다시 방문해야 할 수도 있습니다.	중립
요즘 우리 개를 보면 나를 닮은 것 같아 안타까워.	슬픔
경력단절로 취업이 될까 걱정돼.	불안
또한 다른 가능한 날짜를 살펴보고 대비 대 경우 티켓에 대한 가용성과 가격을 얻을 것입니다.	중립
Cera 사이트에 들어가기 위해 로그인 ID와 비밀번호를 얻을 수 있습니까?	중립
우리 집은 어째서 이렇게 가난할까. 남들은 모두 다니는 학원도 한 번 못 가네.	상처
다음 주에 방문하고 싶습니다.	중립
내가 친구 험담한 걸 알면 어떡하지?	불안
나는 그녀가 그녀가 절단 실 바닥에서 끝나는 많은 일을했으며 분석, 프리젠 테이션 또는 책임의 형성에 참여할 진정한 기회를 얻지 못했다고 생각했다.목요일 프레젠테이션을 위해.	중립
우리는 그 사람들의 모든 비용을 지불 할 것이며 물론 비즈니스 리더는 채용과 함께 할 것이며 날씨는 20 명이 그들의 그룹에 대한 귀중한 팀 플레이어이자 자원이 될 것으로 예상됩니다.	중립
짧은 예의 회의를 위해 그들을 만나고 싶습니까 (5-10 분)?	중립
나는 당신을 36으로 되돌려주기를 고대합니다.전화/컴퓨터를 설정하자마자 그곳으로 이사 할 것입니다. 반 날을 보내겠습니다.	중립
만나서 반가 웠고 기회에 대해 기꺼이 토론하게되어 기쁩니다.	중립
오늘 같이 일하던 동료가 퇴사했어. 그래서 슬퍼.	슬픔
⑴ 총알이나 번호 매기기를 추가 할 텍스트를 선택하십시오.	중립
Scott, 당신은 그것에 대해 스스로 전화를해야합니다 - 나는 당신이 어느 쪽에도 가치를 더할 수 있다고 생각합니다.	중립
다음 주 달라스에서 뵙기를 기대합니다.	중립
팀원이 업무에 실수가 잦아서 힘들어.	상처
월요일에 재편성합시다.	중립
내가 죽으면 내 장례식장에 와서 가족들은 슬퍼하겠지?	불안
노후 자금으로 아들 자취방을 얻어 줬는데 보증금 다 날리고 집으로 돌아왔네? 열불이 나!	분노
청문회에서 당신을 브레브링 할 수 있습니다.	중립
형이 아버지 치매를 이용해 내 재산까지 가로채갔어. 형한테 배신당했어.	상처
나는 항상 높은 성적을 얻으려고 최선을 다하는데 왜 성적이 안 오르는 걸까. 정말 억울해.	슬픔
당신은 당신의 위치에 가까운 밤새 머물 수있는 가장 좋은 호텔이 무엇인지 조언 해 주시겠습니까?	중립
지금 이 회사에 다니고 있다는 것에 충분히 만족스러워.	기쁨
2014 년 7 월 31 일 이후에 서비스를 계속 사용하는 경우 업데이트 된 약관에 동의하거나 동의하지 않으면 언제든지 서비스를 취소 할 수 있습니다.	중립
전환을위한 커뮤니케이션을 처리하는 팀과 연락을 취하거나 개인적으로 나와 대화하여 논의 할 수 있습니까?	중립
On the days where deal 135563 is applicable, the purchases and sale should balance out; no flow.	중립
이것은 프리웨어입니다.	중립
내가 괴롭히던 아이가 자살을 해서 장례식장에 찾아갔어.	당황
FERC CA 분석의 출처를 Becky Cantrell에게 보내주십시오.	중립
몸이 가려워서 병원을 가니 아토피라고 그러는데 당황스럽다.	당황
나 이번에 갑자기 정리해고 당했어.	불안
안녕하세요, 잠시 시간을내어 App Store에서 gdocuments를 확인하십시오.	중립
JEFF, 나는 다음 주 내내 나왔는데, JoAnn에게 전화하면 가격을 얻고 거래에 참가할 것입니다.	중립
pls는 나를 당신에게 데려 간다.Thur에.	중립
남편이 휴가를 받아서 같이 여행을 가기로 했어!	기쁨
나는 West Gas Trading에서 Phillip Allen과 함께 일했고 그는 Greg Piper와 아래에 첨부 된 편지에 대해 이야기했고 Greg는 우리에게 당신에게 전달하라고 말했습니다.	중립
요즘 몸은 아프지만 마음은 느긋해. 곧 태어날 손자 생각에 너무 기뻐!	기쁨
다른 사람들은 나한테 너무 많은 것을 바라는 것 같아.	분노
나는 우리의 형제애 시절부터 9 년 동안 Richard를 알고있었습니다.	중립
오늘도 회사에서 밤새야 할 것 같아.	슬픔
21 세기 자동차 보험에 800-493-9489로 전화하십시오. 추가 할인 자격이 있는지 확인하여 견적을 더 낮추려고 노력할 것입니다.	중립
수표 사본을 우편으로 보내 주시면 올바른 주소를 알려주세요.	중립
이 회사에서 내가 정말 잘해 나갈 수 있을지 의문이야. 확신이 서질 않아.	불안
가끔 듣는 아내의 잔소리에 괴로울 때가 있어.	슬픔
나는 지금 여자친구가 너무 좋은데 자꾸 남의 시선을 의식하게 돼.	당황
Mark와 Trisha를 확인하겠습니다.	중립
지금은 그나마 아픈곳이 없어서 일을 할 수 있는데 언제까지 할 수 있을지 걱정이야.	불안
나 요즘 혼란스러워.	불안
LARENCE, 아래의 인터뷰 일정에 유의하십시오.	중립
이제 Zephyrhills에서 주택 소유자 인용문을 비교하기에 좋은시기입니다.	중립
NASDAQ OTC 보드에서 MSIA를 확인하십시오.	중립
친구들에게 따돌림을 당하고 있어서 너무 속상해.	분노
학교 폭력 가해자로 몰릴 뻔 해서 짜증이 나는 하루였어.	분노
난 노인정을 다니는데 노인정 회장이 회비를 몰래 병원 치료비를 내고 있더라.	상처
어제 친구들이 내 짝을 괴롭혔는데 난 보고만 있었어.	당황
지금 쇼핑을 시작하려면 여기를 클릭하십시오 : $ 링크	중립
측정 문제에 대해 수요 편지를 El Paso에게 보내려는 계획에는 아무런 문제가 없습니다.	중립
하루하루가 아슬아슬해서 힘들어.	상처
Forster 씨가 그것을 만들 수 있다면 Beverly 또는 Kay에게 다음 주에 시간을 내라고 말하십시오.	중립
Kay, 2000 년 9 월 5 일에 Mike Childers (Entergy)와 함께 Mike Miller & Don Miller와 함께 오전 9 시부 터 오후 2 시까 지 예약하십시오.	중립
보험하나 없는데 큰병 걸리면 어쩌지?	불안
당신의 스트레이트 토크 서비스는 내일 06-30-14로 끝납니다.	중립
당신은 아마도 결혼식에 초대를받을 것입니다.	중립
다음 구매 6 파운드 이상으로 3 달러 할인 된 쿠폰을 받으려면 양식을 작성하십시오.	중립
주정부 기관에 대한 유출보고 기록 및 알림을 검토 할 수있었습니다.	중립
우울증을 겪고 있었는데 시험 성적이 잘 안 나와서 더 심해졌어. 나는 왜 이럴까?	분노
맥도날드와 버거 킹이 충돌하고 우리는 어떤 패스트 푸드 레스토랑을 선호하는지 알고 싶습니다.	중립
당신을보고 기대.	중립
결혼식은 너무 허례허식 같아서 정말 생략하고 싶어. 그런데 부모님이 원하시니까 해야 하는 상황이야.	분노
유방암일 가능성이 있어서 상세 검사를 받아야 하는데 별로 내키지 않아.	불안
로그인하고 지불 정보를 작성하면 전체 서비스가 활성화됩니다!	중립
바라건대 우리는 더 간단한 접근법을 찾을 수 있지만, 가장 재정적으로 의미가있는 것처럼 보이면 그와 같은 내재 된 문제가 보이지 않습니다.	중립
지난 화요일 화요일에 제가 알아야 할 회의에서 다른 후속 인포가 있습니까?	중립
Ray에게 최선을 다하고 서둘러서이 엉망진창을 해결하도록 지시하십시오.	중립
그리고 Scott 및/또는 Donald가 참석하고 싶은지 확인해야합니까?	중립
우리가 금요일에 이야기했을 때 언급 한 프레젠테이션을 저에게 전달할 수 있습니까?	중립
오늘따라 정말 화가 많이 나는 상황이네.	분노
The meeting was convened at the request of Doug Arnell, but Jeff Shankman thinks that there is no need for formal meetings: we can ask them for the information directly on as needed basis.	중립
Garden State Paper- 폐쇄 및 전환 문제에 대한 고용 법 조언을 제공했습니다.	중립
제발, 화요일 아침에 전화 해 주시면 제 1 시간 동안 한 시간 동안 종이를 논의 할 것입니다.	중립
오늘 자녀들과 대화하다가 너무 혼란스러웠어.	불안
오늘 성적이 발표되었는데 좀 이상해.	당황
가까운 시일 내에 여러분의 의견을 기다리겠습니다.	중립
회사를 은퇴한 지가 언젠데 자꾸 도와달라는 업무 연락을 하면서 성가시게 구네.	분노
요즘은 우리 두 아들에게 새삼 감사함을 느껴.	기쁨
도시락에 엄마가 달걀말이를 싸주셨는데 어떤 애가 억지로 뺏어먹어서 짜증나.	분노
여자 친구가 화장 안 한 모습을 보고 깜짝 놀랐어.	슬픔
내가 당신의 말을들을 때 나는 그것을 Nui로 보낼 것입니다.	중립
이 나이 먹고 변변찮은 직장도 없고 갈수록 점점 무기력해져.	슬픔
지난번 건강검진을 받았는데 검진 결과가 양호해.	기쁨
약간의 지연 (다음 수요일이나 목요일까지)을 완료 할 가능성이 있습니까?	중립
갱년기라서 여성으로써의 매력이 점점 사라지는 것 같아 싫어.	분노
Blanca는 준비를 도울 수 있습니다.	중립
나는 기술자가 아니므로 비즈니스 개념과 잠재적 인 아이디어와 기회에 대해서만 기술 별 애플리케이션에 대해 논의 할 수 없습니다.	중립
요즘 소화가 안 되고 밥맛이 없어.	당황
Rob, 다른 그룹과 논의하여 기업 기회 (예 : Laura, Hunter 등을 적절하게 정리할 수 있습니까?	중립
나는 당신과 할 일을 공유하고 싶습니다.	중립
이것이 유럽을 위해 글을 쓰는 가장 좋은시기라면, 그와 함께 앞으로 나아가십시오.	중립
노래의 iTunes 판매를 늘리려면 iTunes에서 구매할 수있는 Bander에 추가 한 모든 노래에 iTunes에서 구매할 링크를 추가하십시오.	중립
ISDA에 가입하기 위해 아직 회원이 아닌 목록에있는 사람들을 다시 얻으려고 다시 시도 해야하는 것 같습니다.	중립
메일 요청을 통해 중단하려면 다음으로 보내주십시오.	중립
유방암 항암치료를 하고 있는데 머리가 자꾸 빠져서 스트레스받아.	불안
하고 싶은 게 없는데 계속 진로를 결정하래.	분노
Gmail을 사용한다면 빠른 호의를 베풀 수 있습니까?	중립
저를 루프에 유지하고 적절한 시간에 MKM 그룹을 데려 오십시오 (우리가 평가할 수있는 입찰을 제출하기 전에 충분히).	중립
남편이 좋지 않은 습관이 있는데 고치라고 말하기가 조심스러워.	불안
Kayla01235가 이제 플레이 할 수 있습니다!	중립
가족들 응원으로 나는 항암치료를 이겨낼 수 있다고 믿었고 이겨내어 정말 기뻐.	기쁨
더 이상 그러한 제안을받지 않으려면 링크를 클릭하면 다음을 제거합니다.	중립
나는 건물청소부로 일을 하는데 벌이가 크지 않아서 노후준비를 못 해. 너무 걱정이야.	상처
이러한 문제에 대해 더 많이 논의 할 수 있도록 회의가 예정되어 있습니다.	중립
음성 메일 메시지를 남겨 두려고했지만 사무실의 어느 누구도 내 전화를 음성 메일로 전송하는 방법을 알지 못했습니다.	중립
아내도 사별하고 혼자 사는 게 너무 힘들어.	상처
만나기에 편리한 시간을 알려주세요.	중립
이놈의 남편은 쓸데가 없다니까. 정말 남편 구실을 못 해.	분노
중학교 때 친구가 교내에서 따돌림당하고 있는 걸 봤어. 그런데 겁이 나서 도피해버렸지 뭐야.	당황
나는 지금까지 돈을 많이 모아놨어.	기쁨
그러나 우리는 더 논의해야합니다.매우 흥미로운 아이디어.	중립
