text	emotion
우리는 마을 밖으로 나갈 수 있습니다.	중립
아프고 늙었다고 자식들이 무시해서 화가 나.	분노
일부 컨텐츠 및 서비스에는 특정 하드웨어 또는 소프트웨어 요구 사항이 있습니다.구매하기 전에 제품 정보를 검토하십시오.	중립
치매 걸린 아내를 돌보다가 살해한 남편의 뉴스를 보았어. 어쩌면 좋아 마음이 아프네.	상처
마지막으로, 나는 이것이 단지 행정적인 것일 뿐이라고 Kristi의 Roth IRA는 웹이나 우편으로받는 진술에 나타나지 않습니다.	중립
좋아하는 일을 잘할 때까지 하고 싶어. 근데 실력이 늘지 않아서 어떻게 해야 할지 혼란스러워.	불안
세상에 나 홀로 서 있는 듯한 느낌이 들어.	상처
부모님은 어딜 가든 나를 자랑스럽게 여기셔. 기분이 좋아.	기쁨
의사가 나의 검사 결과를 앞에 놓고 뜸을 들여서 초조해.	불안
그의 생각을 위해 Dave에게 전달하는 것.	중립
여기로 이동하여 이메일 주소를 확인하십시오.	중립
처음 이틀 동안 Todo Pro 로의 트래픽이 많이 유입되었으며 불행히도 서비스는 한 번에 모든 것을 모두 처리 할 수 없었습니다.	중립
나는 그녀가 나에 대해 당신과 이야기했다는 것을 알고 있으며, 언젠가 함께하는 데 관심이 있는지보고 싶었습니다.	중립
허리가 안 좋아서 힘들어.	슬픔
공장에서 일하고 있는데 곧 있으면 나이가 오십 대 후반이여. 너무 힘들고 세상이 다 싫다.	상처
나는 Waco에서 돌아와서 긴급 상황을 금지 할 것입니다.	중립
지인이 약초가 요실금에 좋다고 해서 구입해봤는데 효과가 있을지 모르겠어.	불안
2 주 후에 게임에 가고 싶습니까?	중립
안녕하세요 David : 1 분이되면 프로젝트를 논의하기 위해 전화를 주시겠습니까?	중립
남편이 갑자기 명예퇴직을 당해서 매우 당황스러워.	당황
이것이 당신을 설명한다면, 11 월 29 일 목요일에 우리와 함께하십시오.	중립
담임선생님께 친구를 괴롭혀 곤란하게 했던 것이 너무 죄송해.	당황
내가 올린 보고서를 상사가 집어 던져 눈물이 나는 걸 참았어.	슬픔
내가 죽고 나면 남편이 딸 집에서 같이 살기로 했다지 뭐야.	상처
Jeff Shankman과 만나 의제에 대해 논의합시다.	중립
나는 아무 잘못도 없었는데 누나가 갑자기 내 뺨을 때려서 너무 화가 나고 억울해.	상처
요즘 아빠한테 왜 이렇게 내가 막 대하는지 모르겠어. 나 왜 그럴까?	분노
나이가 더 들기 전에 시집을 가야 하는데 걱정이야.	분노
나는 여전히 내일 아침에 정말로 크 런치되었습니다.	중립
다음 제목은 8 월 28 일 수요일에 제거 될 예정입니다.	중립
부모님의 주소는 무엇입니까?	중립
2012 년 7 월 3 일, PICPLZ는 영구적으로 종료되며 모든 사진과 데이터가 삭제됩니다.	중립
Karen은 내 메일을 모두 읽으므로 너무 개인적인 것을 보내지 마십시오.	중립
오늘 아침 토론을 바탕으로 :	중립
이것을 빨리 요약하겠습니다…	중립
지구의 날에 만들었나요?	중립
부모님이 차라리 절혼 하셨으면 좋겠어. 이제 더이상 아버지의 폭력은 못 견뎌.	슬픔
부모님에게서 독립하고 싶은데 불편한 몸 때문에 혼자 생활하는 게 어려워.	슬픔
회사를 그만두고 나면 생활비를 벌긴 해야하는데 내가 과연 장사를 할 수 있을지 모르겠어.	불안
나 평소에 등하교 다 걸어 다녀서 체력만큼은 내가 우리 반에서 최고일 거야.	기쁨
오늘, 우리는 SDK의 새로운 개정을 발표하게되어 기쁘게 생각합니다. 이는이와 같은 사용 사례를 크게 개선 할 수 있습니다.	중립
이 전자 메일을 인쇄하기 전에 환경을 생각하십시오.	중립
건강이 더 악화가 되는 꿈을 꿔서 괴로워.	상처
집 번호가 없기 때문에 E : Mail과 대화했습니다.	중립
이번에 들어온 신입 중에 나를 무시하는 애가 있거든? 걔한테 일을 일부러 틀리게 알려줬어.	분노
몰래 소개팅에 나갔는데 남자친구한테 너무 미안해.	당황
이 앱을 여러분과 공유하고 싶습니다.	중립
친구가 내 집안 재정 상황을 알게 될까 봐 불안해.	당황
야호! 내가 그토록 바라던 회사에 합격했어.	기쁨
용서해주십시오. 그러나 오늘 우리는 몇시에 얘기 했습니까?	중립
나의 인생에서 육십 조금 넘어 이렇게 자존감을 다 잃을 줄이야. 생각도 못 했는데 비참하게 되었어.	상처
"Reddot은 비즈니스 사용자가 ""빨간색 점을 클릭하여""단순히 웹 사이트를 유지할 수있는 소프트웨어를 제공합니다."	중립
건강검진 결과가 좋게 나와서 기분이 좋아.	기쁨
서비스를 개선하는 방법에 대한 생각이 있으시면 support@proven.com으로 이메일을 보내주십시오.	중립
우리의 하위 커미트는 내일 회의를 위해 제안 된 솔루션에 대한 거래를 마무리하려고합니다.	중립
Re : TX 매입은 금요일에 발표되었습니다.	중립
당신은 당신이 상사가 선택의 중요성에 대해 주지사에게 전화를 걸려고한다고 생각하십니까?	중립
나 요즘 외톨이가 된 것 같아.	상처
몇 주 전에 나는 당신이 휴스턴에 올 때 당신이 만날 주요 개인 목록을 만들었습니다.	중립
보상 계획 및 혜택 계획에 대한 친숙 함을 고려할 때 특히 4.14 절에 대한 귀하의 검토에 감사드립니다.	중립
좋은 소식을 여러분과 공유하고 싶습니다. 우리는 매일 App Store에 새로운 잡지 응용 프로그램을 추가하는 이정표에 도달했습니다!	중립
Bidweek에서 데이터를 보내기 전에 운영되는지 알 수 있도록 답장을 보내주십시오.	중립
진로가 뚜렷하게 정해진 친구를 보면 질투가 나요. 이런 마음을 어떻게 고칠 수 있을까요.	상처
자녀에게 결혼자금을 하나도 지원해 주지 못해서 너무 미안해.	상처
딸이 며칠 전에 운전면허를 땄는데 아직 익숙하지 않아서 오늘 같은 비 오는 날이면 걱정돼.	불안
집에 갔는데 또 결혼은 언제 할 거냐고 묻더라. 난 아직인데 남들 시선이 신경 쓰여.	당황
어제 새벽에 부모님이 다투는 소리를 들었어.	불안
갑자기 불어난 병원비에 너무 걱정돼.	불안
저를 읽으십시오 : 책벌레를위한 4 개의 소셜 미디어 사이트	중립
이번 건강검진에서 고지혈증이 있다 해서 걱정이야.	불안
진, 6 백만 달러는 저와 마티 로젠버그 (Marty Rosenberg) 사이의 협상 된 합의로, 우리가 올해 초 독립 공장의 구조 조정으로 나아가면서 몇 가지 오래된 분쟁으로 협상 한 것입니다. 루스는 행정 지원 이외의 다른 것을 추가했습니다.	중립
의사가 건강 관리를 해야 한다는데 지금 건강만 생각하면 좌절하게 돼.	분노
돌아와서 당신이 괜찮은 것을 알려주십시오!	중립
구독을 취소하고 싶다면 여기 $ 링크로 이동하십시오.	중립
직장에서 성추행하려는 남자 직원이 있어. 너무 혐오스러워.	당황
우리 부모님이 나를 사랑하는지 모르겠어.	상처
평생을 모아둔 노후자금을 사기 당해서 눈앞이 캄캄해.	당황
그러나 어제 휴스턴으로 돌아가는 것이 좋았습니다.	중립
각 이벤트와 관련하여보다 자세한 의제 및 정보를 보려면 계속 읽으십시오.	중립
요새 투자한게 잘못되서 재정상태가 엉망이라 좌절했어.	분노
생성 한 로그인과 비밀번호를 유지하십시오.	중립
바로 사이트를 확인하십시오.	중립
나는 우리의 일정에 대해 잘 모르겠지만, 당신과 일치하는 자유 시간이 있다면 문제를 논의하는 데 시간을 보내고 싶습니다.	중립
이것이 당신에게 w/b에 도달하면.	중립
당연히 날 위로해 줄 거라고 믿었던 친구가 다른 애들과 함께 나를 손가락질 하고 있었어.	상처
"우리는 ""벤치 마크""를 사용하여 유틸리티 구매를 판단한다는 아이디어로 상당한 견인력을 얻고 있습니다."	중립
이번에 건강검진 결과에서 우리 부서 사람들 중 내 건강상태가 가장 양호하다고 나왔어!	기쁨
친구가 나를 많이 도와줘서 좋아	기쁨
월요일에 봐.	중립
내가 학교에서 따돌림 받는데 오늘은 맞기까지 했어.	상처
배우자에게 너무 불만족스러워.	분노
내 아내가 암에 걸렸어. 나 때문인 것 같아서 죄책감을 느껴.	당황
이메일 환경 설정을 업데이트하려면 다음을 방문하십시오.	중립
이용 약관 및 개인 정보 보호 정책 및 안전 정보는이 사이트에 적용됩니다.	중립
평소 수행하는 업무도 충분히 부담이지만 새로운 개발 건으로 추가적인 근무 희생을 강요당하는 것 같아서 몹시 스트레스를 받고 부담스러워.	분노
내일 우리와 함께 토론 해 주시겠습니까?	중립
어제 친구가 브랜드 가방을 메고 다니는 게 부러워서 그 가방을 뺏었어.	당황
안녕하세요 : 이번 주에 SAC에 갔던 매일 4 달러의 통행료를 추가하십시오.	중립
Pat/Christian : 나는 ious가 DWR의 신용에 부정적인 영향을 미칠 무언가를 추천 할만 큼 멍청하지 않을 것이라고 가정하고 있지만, 검토 할 기회가 있는지 확인하고 싶었습니다.내가 가정 한 것만 큼 똑똑합니다.	중립
다른 스피커를 아직 얻었습니까?	중립
통풍 때문에 꾸준히 관리하고 있는데 병원에 갔더니 큰 문제가 없어서 기분이 좋아.	기쁨
이번 주 금요일과 토요일은 50% 할인 된 여성과 소녀 플러리 Mocs* + 쿠폰 코드 251415618을 사용한 모든 정규 가격 상품을 30% 추가로 30% 할인합니다. ** **	중립
친구가 행복해하는 것을 보면 배가 아파 자꾸 질투가 나.	상처
의사가 나한테 술을 끊으래. 난 술 너무 좋아하는데.	슬픔
아이가 나만 보면 용돈을 달라고 해서 피해 다니고 있어.	분노
나이가 들면서 계속 형편이 안 좋아지는 것만 같아 너무 슬퍼.	불안
남편이랑 싸워서 너무 힘들어.	불안
애를 낳는다는 것은 내 시간을 뺏기는 것이라 생각해. 요새 너무 염세적인 상태야. 너무 슬퍼.	슬픔
여자친구가 내 친구하고 더 연락을 많이 하는 거 같아.	상처
이 이메일이 실수로 연락 한 경우 support@monkeyquest.com으로 이메일을 보내주십시오.	중립
나 정말 한심한 것 같아.	당황
이기고 싶다면 지금 검색하십시오	중립
회사 업무 진행 속도가 뒤처지는 것 같아서 걱정돼.	불안
그것이 다니 니스가 테이블에 가져 오면 (그의 큰 가방 $$$$를 세지 말고), 그와의 거래가 실제로 의미가 있습니까?	중립
내가 입원해 있는 사이 마을 청년회에서 우리 집 소 여물을 잘 챙겨 줬을 거야.	당황
친구들이 나한테 말도 안 하고 내가 한 숙제를 보고 있어서 기분이 안 좋아.	분노
전학 간 학교 반에서 친한 친구가 한 명뿐인데 오늘 그 친구가 학교에 안 왔어.	불안
막내 직원이 나보다 더 좋은 아이디어를 내서 내가 조금은 부끄러워졌어.	당황
Are more available?	중립
회원 옵션을 취소하거나 변경하려면 Rhapsody.com에서 내 계정을 방문하십시오.	중립
이번에 친구 녀석이 아홉 살 연하랑 결혼한다네. 난 아직 싱글인데 부러워 죽겠네.	상처
남편은 늘 나를 무시하며 살아.	상처
눈이 찢어질 듯이 아파서 안과에 갔는데 괜찮대. 다행이지.	기쁨
저번 시험보다 평균이 더 올랐어!	기쁨
신고하려고 학교 폭력 증거를 모았는데 뺏겨 버려서 방법이 없네.	분노
새로운 예금 상품은 평균보다 이자가 두 배나 높아서 수익이 좋을 것 같아.	기쁨
나는 결점이있는 모든 거래에 대해이 절차를 따르는 것이 합리적이지 않습니다.	중립
월요일에 당신과 함께 할게요.	중립
집안일을 도와주는 사람이 있으면 좋겠어.	슬픔
난 항상 잘못만 하는 것 같아서 내가 너무 싫어. 그냥 죽고 싶어.	분노
다음 주 후 주가 점심에 가장 적합합니다.	중립
*지도를 수동으로 확인하려면 ...	중립
버거 전쟁이 가열됩니다!맥도날드와 버거 킹이 충돌하고 우리는 어떤 패스트 푸드 레스토랑을 선호하는지 알고 싶습니다.	중립
내일 첫 번째 치료 세션을 시작합니다.	중립
당사는 귀하의 제안 승인 절차를 신속하게하고 채권자 지연을 피하기 위해 회원 서류를 전자적으로 검토하고 제출하도록 요청합니다.	중립
어제 수능을 너무 제대로 봤어. 그동안의 노력을 보상받은 기분이야.	기쁨
하고 싶은 일이 많은데 이 나이에 할 수 있는 일이 제한적이고 많이 없어.	불안
IP-Address가 마지막으로 연결되었을 때와 동일하다고 가정하지 마십시오.	중립
학교 다니기 너무 외로워.	상처
더 이상 메시지를 원하지 않으면 GoHealthInsurance의 모든 이메일 커뮤니케이션에서 귀하를 제거하게되어 기쁩니다.	중립
우리가 언급하지 않은 질문이 있다면, 우리에게 알려 주시면 답변을 추적 할 수 있습니다!	중립
요즘 취업이 어려워서 너무 걱정이야.	불안
가을 밤	중립
판매 시간은 아직 지정되지 않았지만 컨벤션 등록 및 체크인과 일치 할 것입니다.	중립
정말 한심해 죽겠어. 이 나이가 되도록 이루어 놓은 것도 없고. 내 집 한 칸 없으니.	분노
이러한 모든 기술은 전자 메일, 메시징, 검색 및 비즈니스 커뮤니케이션의 트래픽 흐름에 추가됩니다.	중립
Also, please forward to me what I owe you for the plane flight and golf and our share of dinners, drinks, guacamole, etc.	중립
몇 분이 걸리고 최대한 빨리 이것을보아야합니다!	중립
수능이 가까워지는데 성적은 자꾸 떨어지고 있어서 너무 괴로워.	불안
대학 동창의 아내를 우연히 만났어. 아직도 그때 일로 괴로워하더라.	분노
원래 하려던 프로젝트에 못 들어가게 됐어.	상처
We should be back next week, though.	중립
그 부분을 전달할 수 있습니까?	중립
당뇨병 때문에 어렵게 구한 직장을 그만둬야 할 것 같아 답답하고 막막해.	상처
얼마 전 앓고 있던 병이 완치됐어. 이제 몸도 마음도 너무 편안해.	기쁨
친구들 사이가 예전 같지 않아.	분노
나는 여자친구를 많이 아끼고 사랑하는데 여자친구는 그런 것 같지 않아서 같이 있어도 너무 힘들고 외로워.	당황
나는 정량적 금융 경제학의 새로운 과학 석사 프로그램에 관한 우편으로 오늘 정보를 받았습니다.	중립
이 접근법이 발전소가 잉여 전력 판매를 위해 전력망에 최적으로 접근 할 수 있는지 여부는 확실하지 않습니다.	중립
확인 프로세스를 완료하려면 다음 페이지로 이동하십시오.	중립
이 계약의 형태를 논의하기 위해 회의를 예약 할 수 있는지 궁금합니다.	중립
오늘 후회되는 일이 있었어.	슬픔
조수 전화를 걸어 다음 주 초반에 전화를 걸었습니다.	중립
일은 열심히 하는데 티끌 모아 티끌이라고. 부자는 못 될 것 같아.	불안
폭삭 늙은 내 모습이 너무 싫어.	당황
나 오늘 생일이잖아. 딸 때문에 정말 기분이 날아갈 것 같아.	기쁨
여전히 차량을 구매하려면 www.roadloans.com에서 다시 적용 할 수 있습니다.	중립
그것이 당신을 위해 일한다면, 나는 만나서 따라 잡기 위해 어느 날 당신의 사무실에 와서 기쁩니다.	중립
특히, 우리는 다음의 이름과 주소를 찾고 있습니다.	중립
저장하는 마지막 날!	중립
화가 나서 와이프에게 막말할 때마다 죽고 싶어. 내가 배운 사람이었다면 안 이럴 텐데.	분노
만성질환 때문에 건강이 점점 나빠져서 남편에게 피해만 주는 거 같아서 죄책감이 들어.	당황
또한 Central Curve Mappings의 최신 버전을 보내 주시겠습니까?	중립
우리는 당신이 적합한 방식으로 도울 준비를 할 준비가되어 있습니다.)	중립
옷 가게에서 총각이 내가 돈이 없어 보였는지 멸시를 했어. 화가 나서 일부러 비싼 옷을 입고 다시 갔어.	분노
우리 노부부에게 하루 세끼를 다 챙겨먹는 것은 사치야. 우리는 그 정도로 넉넉하지 않아.	상처
마음에 두던 남자에게 분위기가 괜찮다고 생각해서 고백했는데 차였어.	분노
공부 잘하든 못하든 건강하게만 자라다오.	기쁨
SCAL 제품을 약간 약간 변경하십시오.	중립
이번 주에 샌드위치 휴일이 있어서 너무 좋아.	기쁨
나는 어제 당신에게 똑같은 것을 앞으로 나아갈 것입니다. 그러나 당신이 내가 멍청하다고 생각하기를 원하지 않았습니다 !!	중립
기술이 가득한 전기 배가 고픈 회사가 돌아올 때마다 튀어 나오고 큰 전력망이 덜 신뢰할 수있게되면서 더 자주 발생하는 정전 및 브라운 아웃으로 인해 분석가는 분산 에너지 서비스를 가능한 솔루션으로 지적하고 다음 BIG를 지적합니다.다가오는 10 년을위한 투자 기회.	중립
또는 다음 주까지 대화를 연기 할 수 있습니다.	중립
가족 구성원이 없다고 누가 나를 무시하지 않겠지?	당황
나 사실 다리가 불편해. 어서 취업해야 하는데 이런 나를 받아줄 곳이 있을지 걱정이야.	당황
친구들이랑 잘 화해했어.	기쁨
이번 인턴에 지원자가 너무 많아서 걱정했는데 붙었어.	기쁨
오늘 Avon에서 일자리를 신청하십시오.	중립
며칠 전에 남자친구가 나 몰래 내 친구와 문자 연락을 하는걸 봤는데 충격적이야.	상처
- 감각이 세상을 발견하는 데 도움이되는 방법	중립
지금 참여하려면 여기 $ 링크를 클릭하십시오	중립
앨리슨은 우리가 흙 속에서 약간 긁을 수 있다고 말합니다 (나는 역설적입니다). 그래서 일부 사이트 준비는 괜찮다고 확신합니다.	중립
현재, 나는 셀의 구매/판매를 위해 ENRON/CRRA에 대한 의도를 준비하고 있으며, 외부 변호인이 검토 할 개발 계약을 준비하고 있으며, FCE가 검토 할 초안 구매 계약을 제시해야합니다.	중립
나이가 들어 더는 수입이 없어지면서 가족을 부양할 수 없어서 아내와 이혼을 했어.	불안
우리 언니는 맨날 나한테 지적질 하면서 자기 잘못은 인정하려 하지 않아. 정말 스트레스 받아.	불안
너무 답답하고 우울해서 채팅으로 만난 친구한테 고민 상담을 했는데 괜한 짓을 한 것 같아.	당황
이번 수학 테스트도 망했어.	당황
더 이상 당사로부터 메시지를받지 않으려면 링크를 클릭하십시오.	중립
우리는 목요일 오후 7시 저녁 식사에 팀을 초대했습니다.같이 하실래요?	중립
우리는 어딘가에 만나야 할 것입니다.	중립
밀린 병원비 때문에 걱정이 많았는데 친구가 아무 조건 없이 돈을 줘서 해결할 수 있었어. 이런 친구가 있어서 정말 행복해	기쁨
나는 내가 전에 당신에게 물었다는 것을 알고 있지만, 나는 당신의 아빠와 자매의 이메일 주소를 실수로 삭제 한 것 같습니다.	중립
성폭행 당해 아이를 임신 했다는 사실이 나를 미치게 해.	당황
우리는 온라인 시간과 인터넷 프라이버시를 존중하기 때문에 전자 메일 주소를 제 3 자와 공유하지 않을 것입니다.	중립
아픈배우자를 간병한다는것은 참 힘든거같아.	슬픔
환경미화원이 되겠다는데 왜 친구들이 비웃는 걸까?	분노
Reddot은 비즈니스 사용자가 빨간색 점을 클릭하여 웹 사이트를 유지할 수있는 소프트웨어를 제공합니다.	중립
그녀에게 고백 후 처음으로 연락이 와서 다시 만나기로 했는데 너무 기뻐.	기쁨
18 일 저녁 식사와 금요일에 회의에 초대 할 수 있습니까?	중립
이 이메일은 GMS (Global Messaging Software) 엔진으로 구동됩니다.	중립
연애도 많이 해보고 내 생활을 즐기다가 늦게 결혼하는 것도 괜찮은 것 같아.	기쁨
나는 단지 로지가 우리 중 많은 사람들이 그녀의 물건을 보내는 것과 함께 모든 것을 넘어 가지 않도록하고 싶습니다.	중립
부모님의 과잉보호 때문에 여자친구를 아예 못 만나서 울고만 싶어.	슬픔
진실을 벗어나려고 노력할 때 우리의 떨림에 대한 더 많은 화살표.	중립
참석 한 회의에서 당신의 생각을 보내 주셔서 감사합니다.	중립
경험의 질에 대해 알려주기 위해 잠시 시간을 내면 정말 감사하겠습니다.	중립
사십대 중반이 되고 눈건강이 나빠져서 걱정이야.	불안
Dec Forward의 운송 용량 티켓에 대해 Mary 또는 Trisha와 확인해야 할 수도 있습니다.	중립
학교폭력으로 인해 너무 힘들어. 어떻게 하면 좋을까?	불안
친구 생일 선물로 시계를 샀어. 기분이 너무 좋네.	기쁨
Janelle, 나는 당신의 현재 역할에 대한 당신의 생각을 논의 할 30 분을 찾을 수 있기를 바랐습니다.	중립
정신질환으로 인한 발작이 시작되면 나는 그때를 기억 못 해서 자아 혼란이 와.	불안
오늘 만나고 싶다면 괜찮을 것입니다.	중립
AudioBox를 사용하면 미디어 파일을 믹싱하고 재생 목록을 만들고 단일 가상 클라우드를 통해 원활하게 스트리밍 할 수 있습니다.	중립
온라인 관리 프로세스를 시작하려면 다음 인터넷 주소와 비밀번호가 필요합니다.	중립
하루가 열광하기 전에 먼저 논의합시다.	중립
길 가다 아빠랑 마주쳤는데 아빠가 급하게 자리를 피했어.	불안
어제 친구와 대화하다 상처를 줘버리고 말았어. 어쩌지?	불안
이 주문에 대해 문의하려면 주문 참조 번호를 인용하십시오.	중립
오늘도 두 시간도 못 자고 뜬 눈으로 밤을 새웠어. 불면증 때문에 이렇게 힘든데 가족들은 걱정도 안 하네.	상처
나 면접에서 또 떨어졌어. 벌써 몇 번째인지 모르겠네. 정말 고통스러워.	슬픔
나는 Kern Neg.	중립
이번에 청년임대주택 청약에 떨어져서 너무 실망스러워.	슬픔
얼굴에 흉터가 있는데 이것 때문에 취업에 지장이 있을까 봐 걱정돼.	불안
나는 지금도 진로를 정하지 못했는데 고등학교에 입학하니 다들 진로를 정하라고 해.	불안
젊어서부터 공황장애를 앓아서 꾸준히 돈을 벌지 못했어. 그래서 노후준비가 부족해.	슬픔
전화로 논의 된대로 첨부 된 파일을 작성하십시오.	중립
변경하고 싶다면 알려주세요.	중립
내 아기에 관한 이메일에 감사드립니다.	중립
박 씨가 고혈압을 낫게 하는 근거 없는 민간요법을 퍼뜨려.	당황
부모님은 내 진로에 간섭이 너무 심하셔. 공무원을 하라는데 나는 흥미가 없어.	불안
토론 할 수 있도록 저에게 전화하십시오.	중립
내가 어렸을 때 좀 더 배웠더라면 더 멋진 사람들과 어울렸을 텐데. 다 내 탓이야.	분노
친애하는 친구, 나는 지금 사이트 미리보기를 사용하고 있으며 정말 재미 있고 영감을줍니다.	중립
지각을 용서하십시오.	중립
내일 (일요일)에 문을 열면 전화하겠습니다.	중립
GA가 파이프 라인 그룹에 가져온 가치에 대해 논의하고 싶은시기를 알려주십시오.	중립
진지하게, 의제는 에스컬레이션의 풍미가없는 것처럼 보이며, 현재 우리 팀의 매력적인 대안이 부족하다는 점에서 훌륭합니다.	중립
공무원이 과연 내 길인가 싶어. 여러 번 떨어지고 나니 너무 우울하고 포기하고 싶은 마음도 생겼어.	슬픔
승인과 함께 20을 충족하는지 알려주세요.	중립
게이트볼을 하게 됐는데 재미있는 취미를 새로 갖게 돼서 요새 아주 즐거워.	기쁨
따라서 특히 9/11 이후 물류를 감안할 때이 회의를 위해 달라스에 오는 것은 실용적이지 않은 것 같습니다.	중립
친구들이 내게 가까이 하지 말라고 했던 사람이 나한테 사기를 쳤어.	슬픔
타나가 참석할 것입니다.	중립
앞으로 Facebook에서 이러한 이메일을 받고 싶지 않다면 아래 링크를 따라 구독 취소하십시오.	중립
이번 달에 아들이 영양제를 보내지 않아서 너무 화가 났어.	분노
술에 취해 귀가하는 남편이 사고를 치면 뒤처리는 내가 해야 해.	분노
나 정말 억울한 일을 겪었어.	상처
Me Jump -The Ultimate Addictive Arcade Game $ 0.99 BrothersApps	중립
다음 예에서 지금 시도하십시오.	중립
이혼한 후로 경제적으로 여유롭지 않아 아이들에게 제대로 해줄 수 없어서 미안하고 서러워.	슬픔
사람들을 돕고 싶습니까?	중립
